Movie_Rank,year,duration_minutes,age_limit,rating,Number_of_ratings,description,Title,rating_category,decade
4,2003,201,12,9.0,2000000.0,Gandalf and Aragorn lead the World of Men against Sauron's army to draw his gaze from Frodo and Sam as they approach Mount Doom with the One Ring., The Lord of the Rings: The Return of the King,9.0+ (Masterpieces),2000s
29,2023,140,10,8.6,380000.0,"Miles Morales catapults across the multiverse, where he encounters a team of Spider-People charged with protecting its very existence. When the heroes clash on how to handle a new threat, Miles must redefine what it means to be a hero.", Spider-Man: Across the Spider-Verse,8.0 - 8.9 (Great),2020s
53,2002,150,15,8.5,919000.0,"During WWII, acclaimed Polish musician Wladyslaw faces various struggles as he loses contact with his family. As the situation worsens, he hides in the ruins of Warsaw in order to survive.", The Pianist,8.0 - 8.9 (Great),2000s
85,1957,88,10,8.4,214000.0,"After a failed attack on a German position, a general orders three soldiers, chosen at random, court-martialed for cowardice and their commanding officer must defend them.", Paths of Glory,8.0 - 8.9 (Great),1950s
116,1958,128,10,8.3,429000.0,"A former San Francisco police detective juggles wrestling with his personal demons and becoming obsessed with the hauntingly beautiful woman he has been hired to trail, who may be deeply disturbed.", Vertigo,8.0 - 8.9 (Great),1950s
174,2009,129,18,8.2,223000.0,A retired legal counselor writes a novel hoping to find closure for one of his past unresolved homicide cases and for his unreciprocated love with his superior - both of which still haunt him decades later., The Secret in Their Eyes,8.0 - 8.9 (Great),2000s
212,2015,120,15,8.1,1100000.0,"In a post-apocalyptic wasteland, a woman rebels against a tyrannical ruler in search for her homeland with the aid of a group of female prisoners, a psychotic worshipper and a drifter named Max.", Mad Max: Fury Road,8.0 - 8.9 (Great),2010s
335,2007,153,10,8.1,85000.0,"Kabir Khan, the coach of the Indian Women's National Hockey Team, dreams of making his all-girls team emerge victorious against all odds.", Chak De! India,8.0 - 8.9 (Great),2000s
459,2010,115,18,8.0,87000.0,"After a prison riot, former-Captain Nascimento, now a high ranking security officer in Rio de Janeiro, is swept into a bloody political dispute that involves government officials and paramilitary groups.", Elite Squad 2: The Enemy Within,8.0 - 8.9 (Great),2010s
519,1995,83,15,7.9,158000.0,A cyborg policewoman and her partner hunt a mysterious and powerful hacker called the Puppet Master., Ghost in the Shell,7.0 - 7.9 (Good),1990s
536,1951,122,18,7.9,115000.0,Disturbed Blanche DuBois moves in with her sister in New Orleans and is tormented by her brutish brother-in-law while her reality crumbles around her., A Streetcar Named Desire,7.0 - 7.9 (Good),1950s
617,1993,130,15,7.8,168000.0,"A successful lawman's plans to retire anonymously in Tombstone, Arizona, are disrupted by the kind of outlaws he was famous for eliminating.", Tombstone,7.0 - 7.9 (Good),1990s
639,1971,100,0,7.8,229000.0,A poor but hopeful boy seeks one of the five coveted golden tickets that will send him on a tour of Willy Wonka's mysterious chocolate factory., Willy Wonka & the Chocolate Factory,7.0 - 7.9 (Good),1970s
657,2007,157,18,7.8,455000.0,"An outcast New York City cop is charged with bringing down Harlem drug lord Frank Lucas, whose real life inspired this partly biographical film.", American Gangster,7.0 - 7.9 (Good),2000s
671,1969,113,18,7.8,122000.0,"A naive hustler travels from Texas to New York City to seek personal fortune, finding a new friend in the process.", Midnight Cowboy,7.0 - 7.9 (Good),1960s
681,2010,116,15,7.8,390000.0,"Based on the story of Micky Ward, a fledgling boxer who tries to escape the shadow of his more famous but troubled older boxing brother and get his own shot at greatness.", The Fighter,7.0 - 7.9 (Good),2010s
689,1978,127,18,7.8,129000.0,"During an escalating zombie epidemic, two Philadelphia SWAT team members, a traffic reporter and his TV executive girlfriend seek refuge in a secluded shopping mall.", Dawn of the Dead,7.0 - 7.9 (Good),1970s
727,1986,107,15,7.8,77000.0,"Between two Thanksgivings two years apart, Hannah's husband falls in love with her sister Lee, while her hypochondriac ex-husband rekindles his relationship with her sister Holly.", Hannah and Her Sisters,7.0 - 7.9 (Good),1980s
763,2017,132,10,7.8,32000.0,A couple from Chandni Chowk aspire to give their daughter the best education and thus be a part of and accepted by the elite of Delhi., Hindi Medium,7.0 - 7.9 (Good),2010s
880,1987,163,15,7.7,112000.0,"Bernardo Bertolucci's Oscar-winning dramatisation of the life story of China's last emperor, Pu Yi.", The Last Emperor,7.0 - 7.9 (Good),1980s
913,2004,126,15,7.7,105000.0,"Ernesto Guevara de la Serna, popularly known as Che, along with his friend Alberto Granado, decides to take a road trip across South America. His experiences on the journey transform him.", The Motorcycle Diaries,7.0 - 7.9 (Good),2000s
936,2006,120,15,7.7,37000.0,"A manager of an orphanage in India is sent to Copenhagen, Denmark, where he discovers a life-altering family secret.", After the Wedding,7.0 - 7.9 (Good),2000s
213,1974,130,18,8.1,352000.0,"A private detective hired to expose an adulterer in 1930s Los Angeles finds himself caught up in a web of deceit, corruption, and murder.", Chinatown,8.0 - 8.9 (Great),1970s
288,1930,152,10,8.1,68000.0,"A German youth eagerly enters World War I, but his enthusiasm wanes as he gets a firsthand view of the horror.", All Quiet on the Western Front,8.0 - 8.9 (Great),1930s
303,2002,129,12,8.1,26000.0,"As the feudal Japan era draws to a close, a widower samurai experiences difficulty balancing clan loyalties, 2 young daughters, an aged mother, and the sudden reappearance of his childhood sweetheart.", The Twilight Samurai,8.0 - 8.9 (Great),2000s
308,1958,139,10,8.1,43000.0,"Lured by gold, two greedy peasants unknowingly escort a princess and her general across enemy lines.", The Hidden Fortress,8.0 - 8.9 (Great),1950s
327,1999,174,18,8.1,27000.0,"After his brother is killed and father severely injured by terrorists, a young med student quits his studies to join the Indian Police Service to wipe out the terrorists.", Sarfarosh,8.0 - 8.9 (Great),1990s
438,1947,97,10,8.0,41000.0,"A private eye escapes his past to run a gas station in a small town, but his past catches up with him. Now he must return to the big city world of danger, corruption, double crosses, and duplicitous dames.", Out of the Past,8.0 - 8.9 (Great),1940s
477,2023,124,10,7.9,46000.0,"Hirayama cleans public toilets in Tokyo, lives his life in simplicity and daily tranquility. Some encounters also lead him to reflect on himself.", Perfect Days,7.0 - 7.9 (Good),2020s
586,2009,119,12,7.9,57000.0,The mysterious disappearance of a kindergarten teacher during a picnic in the north of Iran is followed by a series of misadventures for her fellow travelers., About Elly,7.0 - 7.9 (Good),2000s
597,2016,130,12,7.9,59000.0,"When Iraq invades Kuwait in August 1990, a callous Indian businessman becomes the spokesperson for more than 170,000 stranded countrymen.", Airlift,7.0 - 7.9 (Good),2010s
693,1990,121,12,7.8,160000.0,"The victims of an encephalitis epidemic many years ago have been catatonic ever since, but now a new drug offers the prospect of reviving them.", Awakenings,7.0 - 7.9 (Good),1990s
701,2013,126,10,7.8,100000.0,"Jiro Horikoshi studies assiduously to fulfill his aim of becoming an aeronautical engineer. As WWII begins, fighter aircraft designed by him end up getting used by the Japanese Empire against its foes.", The Wind Rises,7.0 - 7.9 (Good),2010s
795,2001,116,12,7.7,623000.0,Danny Ocean and his ten accomplices plan to rob three Las Vegas casinos simultaneously., Ocean's Eleven,7.0 - 7.9 (Good),2000s
816,1998,87,0,7.7,318000.0,"To save her father from death in the army, a young maiden secretly goes in his place and becomes one of China's greatest heroines in the process.", Mulan,7.0 - 7.9 (Good),1990s
842,2014,123,12,7.7,484000.0,Stephen Hawking gets unprecedented success in the field of physics despite being diagnosed with motor neuron disease at the age of 21. He defeats awful odds as his first wife Jane aids him loyally., The Theory of Everything,7.0 - 7.9 (Good),2010s
924,1986,107,15,7.7,56000.0,"Two men are framed and sent to jail, where they meet a murderer who helps them escape and leave the state.", Down by Law,7.0 - 7.9 (Good),1980s
939,2002,105,15,7.7,44000.0,A family of Irish immigrants adjust to life on the mean streets of Hell's Kitchen while also grieving the death of a child., In America,7.0 - 7.9 (Good),2000s
981,2011,101,18,7.6,218000.0,A S.W.A.T. team becomes trapped in a tenement run by a ruthless mobster and his army of killers and thugs., The Raid,7.0 - 7.9 (Good),2010s
21,2021,164,Not Rated,8.7,218000.0,"When a tribal man is arrested for a case of alleged theft, his wife turns to a human-rights lawyer to help bring justice.", Jai Bhim,8.0 - 8.9 (Great),2020s
64,2009,153,18,8.4,1600000.0,"In Nazi-occupied France during World War II, a plan to assassinate Nazi leaders by a group of Jewish U.S. soldiers coincides with a theatre owner's vengeful plans for the same.", Inglourious Basterds,8.0 - 8.9 (Great),2000s
89,2021,164,17,8.4,48000.0,"A biopic detailing the 2 decades that Punjabi Sikh revolutionary, Udham Singh, spent planning the assassination of the man responsible for the Jallianwala Bagh massacre.", Sardar Udham,8.0 - 8.9 (Great),2020s
107,1995,81,10,8.3,1100000.0,A cowboy doll is profoundly threatened and jealous when a new spaceman action figure supplants him as top toy in a boy's bedroom., Toy Story,8.0 - 8.9 (Great),1990s
167,1939,238,10,8.2,336000.0,A sheltered and manipulative Southern belle and a roguish profiteer face off in a turbulent romance as the society around them crumbles with the end of slavery and is rebuilt during the Civil War and Reconstruction periods., Gone with the Wind,8.0 - 8.9 (Great),1930s
248,1976,120,10,8.1,632000.0,A small-time Philadelphia boxer gets a supremely rare chance to fight the world heavyweight champion in a bout in which he strives to go the distance for his self-respect., Rocky,8.0 - 8.9 (Great),1970s
363,1967,106,18,8.0,289000.0,A disillusioned college graduate finds himself torn between his older lover and her daughter., The Graduate,8.0 - 8.9 (Great),1960s
375,2006,143,15,8.0,589000.0,"A fisherman, a smuggler, and a syndicate of businessmen match wits over the possession of a priceless diamond.", Blood Diamond,8.0 - 8.9 (Great),2000s
409,1959,141,10,8.0,68000.0,"A small-town sheriff in the American West enlists the help of a disabled man, a drunk, and a young gunfighter in his efforts to hold in jail the brother of the local bad guy.", Rio Bravo,8.0 - 8.9 (Great),1950s
478,2019,130,12,7.9,779000.0,"A detective investigates the death of the patriarch of an eccentric, combative family.", Knives Out,7.0 - 7.9 (Good),2010s
523,2016,106,12,7.9,102000.0,"A young lad notices a beautiful girl who begins to occupy his thoughts. While struggling with poverty, personal relationships and life's woes, he starts a band, hoping to catch her attention.", Sing Street,7.0 - 7.9 (Good),2010s
598,2019,154,12,7.9,37000.0,Based on the life of Patna-based mathematician Anand Kumar who runs the famed Super 30 program for IIT aspirants in Patna., Super 30,7.0 - 7.9 (Good),2010s
808,2002,131,10,7.7,149000.0,"A young man, falsely imprisoned by his jealous ""friend"", escapes and uses a hidden treasure to exact his revenge.", The Count of Monte Cristo,7.0 - 7.9 (Good),2000s
854,2002,115,15,7.7,204000.0,A lovelorn screenwriter becomes desperate as he tries and fails to adapt 'The Orchid Thief' by Susan Orlean for the screen., Adaptation,7.0 - 7.9 (Good),2000s
862,1964,170,0,7.7,102000.0,"In 1910s London, snobbish phonetics professor Henry Higgins agrees to a wager that he can make crude flower girl, Eliza Doolittle, presentable in high society.", My Fair Lady,7.0 - 7.9 (Good),1960s
863,1999,113,15,7.7,354000.0,A puppeteer discovers a portal that leads literally into the head of movie star John Malkovich., Being John Malkovich,7.0 - 7.9 (Good),1990s
932,1989,111,18,7.7,51000.0,A disillusioned assassin accepts one last hit in hopes of using his earnings to restore vision to a singer he accidentally blinded., The Killer,7.0 - 7.9 (Good),1980s
934,2016,124,12,7.7,65000.0,"While Ranaa and Emad, a married couple, are participating in a production of ""Death of a Salesman,"" she is assaulted in their new home, which leaves him determined to find the perpetrator over his wife's traumatized objections.", The Salesman,7.0 - 7.9 (Good),2010s
955,1999,89,15,7.6,289000.0,Three company workers who hate their jobs decide to rebel against their greedy boss., Office Space,7.0 - 7.9 (Good),1990s
49,1994,88,0,8.5,1100000.0,"Lion prince Simba and his father are targeted by his bitter uncle, who wants to ascend the throne himself.", The Lion King,8.0 - 8.9 (Great),1990s
115,2010,103,10,8.3,897000.0,"The toys are mistakenly delivered to a day-care center instead of the attic right before Andy leaves for college, and it's up to Woody to convince the other toys that they weren't abandoned and to return home.", Toy Story 3,8.0 - 8.9 (Great),2010s
184,1961,110,10,8.2,132000.0,A crafty ronin comes to a town divided by two criminal gangs and decides to play them against each other to free the town., Yojimbo,8.0 - 8.9 (Great),1960s
185,2015,163,12,8.2,95000.0,"Desperate measures are taken by a man who tries to save his family from the dark side of the law, after they commit an unexpected crime.", Drishyam,8.0 - 8.9 (Great),2010s
188,2019,132,15,8.2,56000.0,A story of love between a mentally-ill father who was wrongly accused of murder and his lovely six year old daughter. Prison will be their home. Based on the 2013 Korean movie Miracle in Cell No. 7 (2013)., Miracle in Cell No,8.0 - 8.9 (Great),2010s
226,1982,117,18,8.1,827000.0,A blade runner must pursue and terminate four replicants who stole a ship in space and have returned to Earth to find their creator., Blade Runner,8.0 - 8.9 (Great),1980s
278,1946,170,0,8.1,71000.0,"Three World War II veterans, two of them traumatized or disabled, return home to the American midwest to discover that they and their families have been irreparably changed.", The Best Years of Our Lives,8.0 - 8.9 (Great),1940s
292,1982,188,15,8.1,68000.0,"Two young Swedish children in the 1900s experience the many comedies and tragedies of their lively and affectionate theatrical family, the Ekdahls.", Fanny and Alexander,8.0 - 8.9 (Great),1980s
299,1966,121,18,8.1,66000.0,"In the 1950s, fear and violence escalate as the people of Algiers fight for independence from the French government.", The Battle of Algiers,8.0 - 8.9 (Great),1960s
302,1959,99,10,8.1,129000.0,"A young boy, left without attention, delves into a life of petty crime.", The 400 Blows,8.0 - 8.9 (Great),1950s
374,2003,125,10,8.0,460000.0,A frustrated son tries to determine the fact from fiction in his dying father's life., Big Fish,8.0 - 8.9 (Great),2000s
399,1979,94,18,8.0,423000.0,"Born on the original Christmas in the stable next door to Jesus Christ, Brian of Nazareth spends his life being mistaken for a messiah.", Life of Brian,8.0 - 8.9 (Great),1970s
446,2007,96,12,8.0,101000.0,A precocious and outspoken Iranian girl grows up during the Islamic Revolution., Persepolis,8.0 - 8.9 (Great),2000s
538,1965,193,10,7.9,82000.0,"The life of a Russian physician and poet who, although married to another, falls in love with a political activist's wife and experiences hardship during World War I and then the October Revolution.", Doctor Zhivago,7.0 - 7.9 (Good),1960s
543,2002,120,12,7.9,188000.0,"A defense officer, Nameless, was summoned by the King of Qin regarding his success of terminating three warriors.", Hero,7.0 - 7.9 (Good),2000s
573,1983,125,15,7.9,30000.0,"A Russian poet and his interpreter travel to Italy researching the life of an 18th-century composer, and instead meet a ruminative madman who tells the poet how the world may be saved.", Nostalgia,7.0 - 7.9 (Good),1980s
591,1946,96,10,7.9,28000.0,"A beautiful young woman takes her father's place as the prisoner of a mysterious beast, who wishes to marry her.", La Belle et la BÃªte,7.0 - 7.9 (Good),1940s
605,2005,129,0,7.8,333000.0,"Sparks fly when spirited Elizabeth Bennet meets single, rich, and proud Mr. Darcy. But Mr. Darcy reluctantly finds himself falling in love with a woman beneath his class. Can each overcome their own pride and prejudice?", Pride & Prejudice,7.0 - 7.9 (Good),2000s
748,1946,118,10,7.8,27000.0,"A humble orphan boy in 1810s Kent is given the opportunity to go to London and become a gentleman, with the help of an unknown benefactor.", Great Expectations,7.0 - 7.9 (Good),1940s
797,1986,120,18,7.7,217000.0,"The discovery of a severed human ear found in a field leads a young man on an investigation related to a beautiful, mysterious nightclub singer and a group of psychopathic criminals who have kidnapped her child.", Blue Velvet,7.0 - 7.9 (Good),1980s
841,2004,108,12,7.7,489000.0,"When Jason Bourne is framed for a CIA operation gone awry, he is forced to resume his former life as a trained assassin to survive.", The Bourne Supremacy,7.0 - 7.9 (Good),2000s
845,2011,98,15,7.7,100000.0,A substitute teacher who drifts from classroom to classroom finds a connection to the students and teachers during his latest assignment., Detachment,7.0 - 7.9 (Good),2010s
928,2002,114,15,7.7,29000.0,Three young Irish women struggle to maintain their spirits while they endure dehumanizing abuse as inmates of a Magdalene Sisters Asylum., The Magdalene Sisters,7.0 - 7.9 (Good),2000s
946,2001,152,10,7.6,861000.0,"An orphaned boy enrolls in a school of wizardry, where he learns the truth about himself, his family and the terrible evil that haunts the magical world.", Harry Potter and the Philosopher's Stone,7.0 - 7.9 (Good),2000s
105,1968,149,0,8.3,723000.0,"After uncovering a mysterious artifact buried beneath the Lunar surface, a spacecraft is sent to Jupiter to find its origins: a spacecraft manned by two men and the supercomputer HAL 9000.", 2001: A Space Odyssey,8.0 - 8.9 (Great),1960s
182,2019,96,10,8.2,191000.0,"A simple act of kindness always sparks another, even in a frozen, faraway place. When Smeerensburg's new postman, Jesper, befriends toymaker Klaus, their gifts melt an age-old feud and deliver a sleigh full of holiday traditions.", Klaus,8.0 - 8.9 (Great),2010s
222,2007,111,10,8.1,832000.0,A rat who can cook makes an unusual alliance with a young kitchen worker at a famous Paris restaurant., Ratatouille,8.0 - 8.9 (Great),2000s
239,2001,92,0,8.1,984000.0,"In order to power the city, monsters have to scare children so that they scream. However, the children are toxic to the monsters, and after a child gets through, two monsters realize things may not be what they think."," Monsters, Inc",8.0 - 8.9 (Great),2000s
272,1949,104,10,8.1,183000.0,"Pulp novelist Holly Martins travels to shadowy, postwar Vienna, only to find himself investigating the mysterious death of an old friend, Harry Lime.", The Third Man,8.0 - 8.9 (Great),1940s
355,2015,144,12,8.0,931000.0,"An astronaut becomes stranded on Mars after his team assume him dead, and must rely on his ingenuity to find a way to signal to Earth that he is alive and can survive until a potential rescue.", The Martian,8.0 - 8.9 (Great),2010s
492,2000,122,15,7.9,295000.0,A high-school boy in the early 1970s is given the chance to write a story for Rolling Stone magazine about an up-and-coming rock band as he accompanies them on their concert tour., Almost Famous,7.0 - 7.9 (Good),2000s
503,2021,242,15,7.9,441000.0,"Determined to ensure that Superman's ultimate sacrifice wasn't in vain, Bruce Wayne recruits a team of metahumans to protect the world from an approaching threat of catastrophic proportions.", Zack Snyder's Justice League,7.0 - 7.9 (Good),2020s
555,1950,94,10,7.9,36000.0,"A potentially violent screenwriter is a murder suspect until his lovely neighbor clears him. However, she soon starts to have her doubts.", In a Lonely Place,7.0 - 7.9 (Good),1950s
589,2004,88,15,7.9,59000.0,A transient young man breaks into empty homes to partake of the vacationing residents' lives for a few days., 3-Iron,7.0 - 7.9 (Good),2000s
645,1989,108,10,7.8,576000.0,"After visiting 2015, Marty McFly must repeat his visit to 1955 to prevent disastrous changes to 1985...without interfering with his first trip.", Back to the Future Part II,7.0 - 7.9 (Good),1980s
703,1939,96,0,7.8,54000.0,A group of people traveling on a stagecoach find their journey complicated by the threat of Geronimo and learn something about each other in the process., Stagecoach,7.0 - 7.9 (Good),1930s
757,1992,85,0,7.8,71000.0,The Muppets present their own touching rendition of Charles Dickens' classic tale., The Muppet Christmas Carol,7.0 - 7.9 (Good),1990s
802,2008,90,18,7.7,637000.0,"A retired CIA agent travels across Europe and relies on his old skills to save his estranged daughter, who has been kidnapped while on a trip to Paris.", Taken,7.0 - 7.9 (Good),2000s
933,2000,110,15,7.7,34000.0,"After a shooting incident at the North-South Korean border DMZ leaves two North Korean soldiers dead, a neutral Swiss and Swedish team investigates what actually happened.", Joint Security Area,7.0 - 7.9 (Good),2000s
977,2009,129,12,7.6,362000.0,"The story of Michael Oher, a homeless and traumatized boy who became an All-American football player and first-round NFL draft pick with the help of a caring woman and her family.", The Blind Side,7.0 - 7.9 (Good),2000s
43,1979,117,18,8.5,957000.0,The crew of a commercial spacecraft encounters a deadly lifeform after investigating a mysterious transmission of unknown origin., Alien,8.0 - 8.9 (Great),1970s
79,2018,117,10,8.4,678000.0,Teen Miles Morales becomes the Spider-Man of his universe and must join with five spider-powered individuals from other dimensions to stop a threat for all realities., Spider-Man: Into the Spider-Verse,8.0 - 8.9 (Great),2010s
84,1981,149,18,8.4,265000.0,A German U-boat stalks the frigid waters of the North Atlantic as its young crew experience the sheer terror and claustrophobic life of a submariner in World War II., Das Boot,8.0 - 8.9 (Great),1980s
131,1952,143,10,8.3,88000.0,A bureaucrat tries to find meaning in his life after he discovers he has terminal cancer., Ikiru,8.0 - 8.9 (Great),1950s
289,1953,131,10,8.1,67000.0,"In a decrepit South American village, four men are hired to transport an urgent nitroglycerine shipment without the equipment that would make it safe.", The Wages of Fear,8.0 - 8.9 (Great),1950s
305,1975,204,10,8.1,59000.0,"After his family is murdered by a notorious and ruthless bandit, a former police officer enlists the services of two outlaws to capture the bandit.", Sholay,8.0 - 8.9 (Great),1970s
545,1971,91,18,7.9,82000.0,"Young, rich, and obsessed with death, Harold finds himself changed forever when he meets lively septuagenarian Maude at a funeral.", Harold and Maude,7.0 - 7.9 (Good),1970s
776,2009,100,18,7.7,851000.0,"Three buddies wake up from a bachelor party in Las Vegas, with no memory of the previous night and the bachelor missing. They make their way around the city in order to find their friend before his wedding.", The Hangover,7.0 - 7.9 (Good),2000s
820,1988,104,10,7.7,218000.0,"When a cartoon rabbit is accused of murder, he enlists the help of a burnt out private investigator to prove his innocence.", Who Framed Roger Rabbit,7.0 - 7.9 (Good),1980s
944,2023,132,15,7.6,74000.0,"The true story of the inseparable Von Erich brothers, who made history in the intensely competitive world of professional wrestling in the early 1980s.", The Iron Claw,7.0 - 7.9 (Good),2020s
996,1991,116,15,7.6,129000.0,A renowned New York playwright is enticed to California to write for the movies and discovers the hellish truth of Hollywood., Barton Fink,7.0 - 7.9 (Good),1990s
109,2012,115,15,8.3,367000.0,"A teacher lives a lonely life, all the while struggling over his son's custody. His life slowly gets better as he finds love and receives good news from his son, but his new luck is about to be brutally shattered by an innocent little lie.", The Hunt,8.0 - 8.9 (Great),2010s
143,1993,127,10,8.2,1100000.0,A pragmatic paleontologist touring an almost complete theme park on an island in Central America is tasked with protecting a couple of kids after a power failure causes the park's cloned dinosaurs to run loose., Jurassic Park,8.0 - 8.9 (Great),1990s
146,2021,148,12,8.2,888000.0,"With Spider-Man's identity now revealed, Peter asks Doctor Strange for help. When a spell goes wrong, dangerous foes from other worlds start to appear, forcing Peter to discover what it truly means to be Spider-Man.", Spider-Man: No Way Home,8.0 - 8.9 (Great),2020s
153,2005,140,12,8.2,1600000.0,"After witnessing his parents' death, Bruce learns the art of fighting to confront injustice. When he returns to Gotham as Batman, he must stop a secret society that intends to destroy the city.", Batman Begins,8.0 - 8.9 (Great),2000s
154,2007,158,12,8.2,644000.0,"A story of family, religion, hatred, oil and madness, focusing on a turn-of-the-century prospector in the early days of the business.", There Will Be Blood,8.0 - 8.9 (Great),2000s
263,1993,133,15,8.1,188000.0,"An Irish man's coerced confession to an I.R.A. bombing he did not commit results in the imprisonment of his father as well. Meanwhile, a British lawyer fights to clear their names and free them.", In the Name of the Father,8.0 - 8.9 (Great),1990s
266,1980,129,18,8.1,382000.0,"The life of boxer Jake LaMotta, whose violence and temper that led him to the top in the ring destroyed his life outside of it.", Raging Bull,8.0 - 8.9 (Great),1980s
