Movie_Rank,year,duration_minutes,age_limit,rating,Number_of_ratings,description,Title,rating_category,decade
352,2016,128,12,8.0,678000.0,"While navigating their careers in Los Angeles, a pianist and an actress fall in love while attempting to reconcile their aspirations for the future.", La La Land,8.0 - 8.9 (Great),2010s
358,2006,144,15,8.0,697000.0,"After earning a licence to kill, secret agent James Bond sets out on his first mission as 007. Bond must defeat a private banker funding terrorists in a high-stakes game of poker at Casino Royale, in Montenegro.", Casino Royale,8.0 - 8.9 (Great),2000s
378,1988,133,15,8.0,549000.0,"After a selfish L.A. yuppie learns his estranged father left a fortune to an autistic-savant brother in Ohio that he didn't know existed, he absconds with his brother and sets out across the country, hoping to gain a larger inheritance.", Rain Man,8.0 - 8.9 (Great),1980s
383,1955,92,18,8.0,98000.0,"A self-proclaimed preacher marries a gullible widow whose young children are reluctant to tell him where their real dad hid the $10,000 he'd stolen in a robbery.", The Night of the Hunter,8.0 - 8.9 (Great),1950s
441,2001,137,Not Rated,8.0,51000.0,"A young man sees a drunk, cute woman standing too close to the tracks at a metro station in Seoul and pulls her back. She ends up getting him into trouble repeatedly after that, starting on the train.", My Sassy Girl,8.0 - 8.9 (Great),2000s
445,1972,138,18,8.0,50000.0,"A man who loves games and theater invites his wife's lover to meet him, setting up a battle of wits with potentially deadly results.", Sleuth,8.0 - 8.9 (Great),1970s
453,1962,95,10,8.0,40000.0,"During WWII, Soviet orphan Ivan Bondarev strikes up a friendship with three sympathetic Soviet officers while working as a scout behind the German lines.", Ivan's Childhood,8.0 - 8.9 (Great),1960s
487,2001,147,15,7.9,386000.0,"After a car wreck on Mulholland Drive renders a woman amnesiac, she and a Hollywood-hopeful search for clues and answers across Los Angeles in a twisting venture beyond dreams and reality.", Mulholland Drive,7.0 - 7.9 (Good),2000s
498,2012,103,12,7.9,551000.0,"Charlie, a 15-year-old introvert, enters high school and is nervous about his new life. When he befriends his seniors, he learns to cope with his friend's suicide and his tumultuous past.", The Perks of Being a Wallflower,7.0 - 7.9 (Good),2010s
550,1946,102,18,7.9,108000.0,The daughter of a convicted German spy is asked by American agents to gather information on a ring of German scientists in South America. How far will she have to go to ingratiate herself with them?, Notorious,7.0 - 7.9 (Good),1940s
636,2015,138,12,7.8,978000.0,"As a new threat to the galaxy rises, Rey, a desert scavenger, and Finn, an ex-stormtrooper, must join Han Solo and Chewbacca to search for the one hope of restoring peace.", Star Wars: Episode VII - The Force Awakens,7.0 - 7.9 (Good),2010s
709,1944,114,10,7.8,34000.0,"Ten years after her aunt was murdered in their London home, a woman returns from Italy in the 1880s to resume residence with her new husband. His obsessive interest in the home rises from a secret that may require driving his wife insane.", Gaslight,7.0 - 7.9 (Good),1940s
738,1962,90,10,7.8,28000.0,"Cleo, a singer and hypochondriac, becomes increasingly worried that she might have cancer while awaiting test results from her doctor.", ClÃ©o from 5 to 7,7.0 - 7.9 (Good),1960s
827,1964,110,10,7.7,203000.0,"While investigating a gold magnate's smuggling, James Bond uncovers a plot to contaminate the Fort Knox gold reserve.", Goldfinger,7.0 - 7.9 (Good),1960s
855,1971,102,18,7.7,169000.0,"When a man calling himself ""the Scorpio Killer"" menaces San Francisco, tough-as-nails Police Inspector ""Dirty"" Harry Callahan is assigned to track down the crazed psychopath.", Dirty Harry,7.0 - 7.9 (Good),1970s
917,1932,93,18,7.7,30000.0,"An ambitious and nearly insane violent gangster climbs the ladder of success in the mob, but his weaknesses prove to be his downfall.", Scarface,7.0 - 7.9 (Good),1930s
931,2006,98,12,7.7,71000.0,"A high-school girl named Makoto acquires the power to travel back in time, and decides to use it for her own personal benefits. Little does she know that she is affecting the lives of others just as much as she is her own.", The Girl Who Leapt Through Time,7.0 - 7.9 (Good),2000s
10,2023,147,12,8.9,119000.0,The real-life story of IPS Officer Manoj Kumar Sharma and IRS Officer Shraddha Joshi., 12th Fail,8.0 - 8.9 (Great),2020s
20,1980,124,0,8.7,1400000.0,"After the Rebel Alliance are overpowered by the Empire, Luke Skywalker begins his Jedi training with Yoda, while his friends are pursued across the galaxy by Darth Vader and bounty hunter Boba Fett.", Star Wars: Episode V - The Empire Strikes Back,8.0 - 8.9 (Great),1980s
173,1963,172,10,8.2,260000.0,Allied prisoners of war plan for several hundred of their number to escape from a German camp during World War II., The Great Escape,8.0 - 8.9 (Great),1960s
319,2015,163,12,8.1,98000.0,An Indian man with a magnanimous heart takes a young mute Pakistani girl back to her homeland to reunite her with her family., Bajrangi Bhaijaan,8.0 - 8.9 (Great),2010s
330,2013,87,15,8.1,49000.0,"In 1992, war rages in Abkhazia, a breakaway region of Georgia. An Estonian man, Ivo, has decided to stay behind and harvest his crops of tangerines. In a bloody conflict at his door, a wounded man is left behind, and Ivo takes him in.", Tangerines,8.0 - 8.9 (Great),2010s
379,1992,156,15,8.0,331000.0,"A prep school student needing money agrees to ""babysit"" a blind man, but the job is not at all what he anticipated.", Scent of a Woman,8.0 - 8.9 (Great),1990s
426,2020,103,10,8.0,39000.0,A young apprentice hunter and her father journey to Ireland to help wipe out the last wolf pack. But everything changes when she befriends a free-spirited girl from a mysterious tribe rumored to transform into wolves by night., Wolfwalkers,8.0 - 8.9 (Great),2020s
464,2004,140,17,8.0,41000.0,"When two brothers are forced to fight in the Korean War, the elder decides to take the riskiest missions if it will help shield the younger from battle.", Brotherhood,8.0 - 8.9 (Great),2000s
495,2014,165,15,7.9,368000.0,"The life of Mason, from early childhood to his arrival at college.", Boyhood,7.0 - 7.9 (Good),2010s
512,2013,117,15,7.9,521000.0,"In 1985 Dallas, electrician and hustler Ron Woodroof works around the system to help AIDS patients get the medication they need after he is diagnosed with the disease.", Dallas Buyers Club,7.0 - 7.9 (Good),2010s
548,1963,186,10,7.9,29000.0,"The Prince of Salina, a noble aristocrat of impeccable integrity, tries to preserve his family and class amid the tumultuous social upheavals of 1860s Sicily.", The Leopard,7.0 - 7.9 (Good),1960s
562,1938,102,0,7.9,55000.0,"When Prince John and the Norman Lords begin oppressing the Saxon masses in King Richard's absence in 1190s England, a Saxon lord fights back as the outlaw leader of a resistance movement.", The Adventures of Robin Hood,7.0 - 7.9 (Good),1930s
618,2023,105,12,7.8,121000.0,"Nora and Hae Sung, two deeply connected childhood friends, are wrested apart after Nora's family emigrates from South Korea. Twenty years later, they are reunited for one fateful week as they confront notions of love and destiny.", Past Lives,7.0 - 7.9 (Good),2020s
790,2010,146,12,7.7,603000.0,"As Harry, Ron and Hermione race against time and evil to destroy the Horcruxes, they uncover the existence of the three most powerful objects in the wizarding world: the Deathly Hallows.", Harry Potter and the Deathly Hallows: Part 1,7.0 - 7.9 (Good),2010s
881,2004,152,15,7.7,158000.0,"The story of the life and career of the legendary rhythm and blues musician Ray Charles, from his humble beginnings in the South, where he went blind at age seven, to his meteoric rise to stardom during the 1950s and 1960s.", Ray,7.0 - 7.9 (Good),2000s
929,2003,80,12,7.7,57000.0,"When her grandson is kidnapped during the Tour de France, Madame Souza and her beloved pooch Bruno team up with the Belleville Sisters--an aged song-and-dance team from the days of Fred Astaire--to rescue him.", The Triplets of Belleville,7.0 - 7.9 (Good),2000s
948,2023,206,15,7.6,248000.0,"When oil is discovered in 1920s Oklahoma under Osage Nation land, the Osage people are murdered one by one - until the FBI steps in to unravel the mystery.", Killers of the Flower Moon,7.0 - 7.9 (Good),2020s
17,1999,136,15,8.7,2100000.0,"When a beautiful stranger leads computer hacker Neo to a forbidding underworld, he discovers the shocking truth--the life he knows is the elaborate deception of an evil cyber-intelligence.", The Matrix,8.0 - 8.9 (Great),1990s
41,2000,155,15,8.5,1600000.0,A former Roman General sets out to exact vengeance against the corrupt emperor who murdered his family and sent him into slavery., Gladiator,8.0 - 8.9 (Great),2000s
138,2018,146,Not Rated,8.3,51000.0,A sub-inspector sets out in pursuit of a mysterious serial killer who targets teen school girls and murders them brutally., Raatchasan,8.0 - 8.9 (Great),2010s
140,2022,130,12,8.2,710000.0,"After thirty years, Maverick is still pushing the envelope as a top naval aviator, but must confront ghosts of his past when he leads TOP GUN's elite graduates on a mission that demands the ultimate sacrifice from those chosen to fly it.", Top Gun: Maverick,8.0 - 8.9 (Great),2020s
165,1992,130,15,8.2,438000.0,"Retired Old West gunslinger William Munny reluctantly takes on one last job, with the help of his old partner Ned Logan and a young man, The ""Schofield Kid.""", Unforgiven,8.0 - 8.9 (Great),1990s
218,1984,107,18,8.1,929000.0,"A human soldier is sent from 2029 to 1984 to stop an almost indestructible cyborg killing machine, sent from the same year, which has been programmed to execute a young woman whose unborn son is the key to humanity's future salvation.", The Terminator,8.0 - 8.9 (Great),1980s
334,1961,91,18,8.1,26000.0,"Viridiana, a young nun about to take her final vows, pays a visit to her widowed uncle at the request of her Mother Superior.", Viridiana,8.0 - 8.9 (Great),1960s
401,1971,118,18,8.0,53000.0,"In 1951, a group of high schoolers come of age in a bleak, isolated, atrophied North Texas town that is slowly dying, both culturally and economically.", The Last Picture Show,8.0 - 8.9 (Great),1970s
404,1984,117,Unknown,8.0,184000.0,Warrior and pacifist Princess Nausicaä desperately struggles to prevent two warring nations from destroying themselves and their dying planet., NausicaÃ¤ of the Valley of the Wind,8.0 - 8.9 (Great),1980s
418,2007,115,18,8.0,111000.0,"In 1997 Rio de Janeiro, Captain Nascimento has to find a substitute for his position while trying to take down drug dealers and criminals before the Pope visits.", Elite Squad,8.0 - 8.9 (Great),2000s
474,2023,141,17,7.9,276000.0,"An account of the fantastical evolution of Bella Baxter, a young woman brought back to life by the brilliant and unorthodox scientist Dr. Godwin Baxter.", Poor Things,7.0 - 7.9 (Good),2020s
517,1944,88,10,7.9,52000.0,A police detective falls in love with the woman whose murder he is investigating., Laura,7.0 - 7.9 (Good),1940s
590,2007,113,15,7.9,63000.0,A woman assists her friend in arranging an illegal abortion in 1980s Romania.," 4 Months, 3 Weeks and 2 Days",7.0 - 7.9 (Good),2000s
675,2012,94,12,7.8,368000.0,"Two 12-year-olds, who live on an island, fall in love with each other and elope into the wilderness. While people set out on a search mission, a violent storm approaching them catches their attention.", Moonrise Kingdom,7.0 - 7.9 (Good),2010s
704,1963,113,10,7.8,86000.0,Romance and suspense ensue in Paris as a woman is pursued by several men who want a fortune her murdered husband had stolen. Whom can she trust?, Charade,7.0 - 7.9 (Good),1960s
847,2013,132,12,7.7,498000.0,"After the crew of the Enterprise find an unstoppable force of terror from within their own organization, Captain Kirk leads a manhunt to a war-zone world to capture a one-man weapon of mass destruction.", Star Trek Into Darkness,7.0 - 7.9 (Good),2010s
876,2013,141,15,7.7,98000.0,"Jep Gambardella has seduced his way through the lavish nightlife of Rome for decades, but after his 65th birthday and a shock from the past, Jep looks past the nightclubs and parties to find a timeless landscape of absurd, exquisite beauty.", The Great Beauty,7.0 - 7.9 (Good),2010s
987,1998,93,15,7.6,199000.0,"A teenager at Rushmore Academy falls for a much older teacher and befriends a middle-aged industrialist. Later, he finds out that his love interest and his friend are having an affair, which prompts him to begin a vendetta.", Rushmore,7.0 - 7.9 (Good),1990s
993,1955,111,10,7.6,98000.0,"A rebellious young man with a troubled past comes to a new town, finding friends and enemies.", Rebel Without a Cause,7.0 - 7.9 (Good),1950s
1000,1975,85,10,7.6,41000.0,"In czarist Russia, a neurotic soldier and his distant cousin formulate a plot to assassinate Napoleon.", Love and Death,7.0 - 7.9 (Good),1970s
47,1960,109,15,8.5,722000.0,A secretary on the run for embezzlement takes refuge at a secluded California motel owned by a repressed man and his overbearing mother., Psycho,8.0 - 8.9 (Great),1960s
58,1988,89,12,8.5,313000.0,A young boy and his little sister struggle to survive in Japan during World War II., Grave of the Fireflies,8.0 - 8.9 (Great),1980s
155,2000,104,18,8.2,915000.0,"Unscrupulous boxing promoters, violent bookmakers, a Russian gangster, incompetent amateur robbers and supposedly Jewish jewelers fight to track down a priceless stolen diamond.", Snatch,8.0 - 8.9 (Great),2000s
162,1997,138,18,8.2,621000.0,"As corruption grows in 1950s Los Angeles, three policemen - one strait-laced, one brutal, and one sleazy - investigate a series of murders with their own brand of justice.", L,8.0 - 8.9 (Great),1990s
186,1997,89,10,8.2,81000.0,"After a boy loses his sister's pair of shoes, he goes on a series of adventures in order to find them. When he can't, he tries a new way to ""win"" a new pair.", Children of Heaven,8.0 - 8.9 (Great),1990s
210,2012,135,12,8.2,38000.0,"The story of Paan Singh Tomar, an Indian athlete and seven-time national steeplechase champion who becomes one of the most feared dacoits in Chambal Valley after his retirement.", Paan Singh Tomar,8.0 - 8.9 (Great),2010s
215,1975,124,10,8.1,664000.0,"When a killer shark unleashes chaos on a beach community off Cape Cod, it's up to a local sheriff, a marine biologist, and an old seafarer to hunt the beast down.", Jaws,8.0 - 8.9 (Great),1970s
225,2016,145,18,8.1,175000.0,"A woman is hired as a handmaiden to a Japanese heiress, but secretly she is involved in a plot to defraud her.", The Handmaiden,8.0 - 8.9 (Great),2010s
229,2011,130,12,8.1,954000.0,"Harry, Ron, and Hermione search for Voldemort's remaining Horcruxes in their effort to destroy the Dark Lord as the final battle rages on at Hogwarts.", Harry Potter and the Deathly Hallows: Part 2,8.0 - 8.9 (Great),2010s
261,1962,123,10,8.1,83000.0,A senator returns to a Western town for the funeral of an old friend and tells the story of his origins., The Man Who Shot Liberty Valance,8.0 - 8.9 (Great),1960s
276,2000,154,18,8.1,254000.0,"An amateur dog fighter, a supermodel, and a derelict assassin, all separately struggling to find love, find their lives transformed by a devastating car wreck in Mexico City.", Amores perros,8.0 - 8.9 (Great),2000s
340,2005,122,12,8.1,36000.0,"The cathartic tale of a young woman who can't see, hear, or speak, and the teacher who brings a ray of light into her dark world.", Black,8.0 - 8.9 (Great),2000s
410,1952,85,0,8.0,111000.0,"A town Marshal, despite the disagreements of his newlywed bride and the townspeople around him, must face a gang of deadly killers alone at ""high noon"" when the gang leader, an outlaw he ""sent up"" years ago, arrives on the noon train.", High Noon,8.0 - 8.9 (Great),1950s
489,1993,119,18,7.9,244000.0,"In Detroit, a pop-culture nerd steals cocaine from his new wife's pimp and tries to sell it in Hollywood, prompting the mobsters who own the drugs to pursue the couple.", True Romance,7.0 - 7.9 (Good),1990s
556,2017,137,15,7.9,32000.0,"A widowed father and taxi driver who drives a German reporter from Seoul to Gwangju to cover the 1980 uprising, soon finds himself regretting his decision after being caught in the violence around him.", A Taxi Driver,7.0 - 7.9 (Good),2010s
620,2017,106,12,7.8,745000.0,"Allied soldiers from Belgium, the British Commonwealth and Empire, and France are surrounded by the German Army and evacuated during a fierce battle in World War II.", Dunkirk,7.0 - 7.9 (Good),2010s
643,2022,148,15,7.8,249000.0,A young German soldier's terrifying experiences and distress on the western front during World War I., All Quiet on the Western Front,7.0 - 7.9 (Good),2020s
697,1982,109,10,7.8,120000.0,A passionate yet unsuccessful comedian stalks and kidnaps his idol to take the spotlight for himself., The King of Comedy,7.0 - 7.9 (Good),1980s
705,1999,108,10,7.8,99000.0,"The true story of Homer Hickam, a coal miner's son who was inspired by the first Sputnik launch to take up rocketry against his father's wishes.", October Sky,7.0 - 7.9 (Good),1990s
716,1975,129,10,7.8,52000.0,"In 1880s India, two former British soldiers decide to set themselves up as Kings in Kafiristan, a land where no white man has set foot since Alexander the Great.", The Man Who Would Be King,7.0 - 7.9 (Good),1970s
755,2013,121,10,7.8,28000.0,"Ryota is a successful workaholic businessman. When he learns that his biological son was switched with another boy after birth, he faces the difficult decision to choose his true son or the boy he and his wife have raised as their own."," Like Father, Like Son",7.0 - 7.9 (Good),2010s
775,2005,134,15,7.7,385000.0,Ennis and Jack are two shepherds who develop a sexual and emotional relationship. Their relationship becomes complicated when both of them get married to their respective girlfriends., Brokeback Mountain,7.0 - 7.9 (Good),2000s
823,2012,122,15,7.7,745000.0,"After a stint in a mental institution, former teacher Pat Solitano moves back in with his parents and tries to reconcile with his ex-wife. Things get more challenging when Pat meets Tiffany, a mysterious girl with problems of her own.", Silver Linings Playbook,7.0 - 7.9 (Good),2010s
990,2015,108,10,7.6,67000.0,"A little girl lives in a very grown-up world with her mother, who tries to prepare her for it. Her neighbor, the Aviator, introduces the girl to an extraordinary world where anything is possible, the world of the Little Prince.", The Little Prince,7.0 - 7.9 (Good),2010s
68,2019,122,15,8.4,1500000.0,"During the 1980s, a failed stand-up comedian is driven insane and turns to a life of crime and chaos in Gotham City while becoming an infamous psychopathic crime figure.", Joker,8.0 - 8.9 (Great),2010s
132,2007,162,10,8.3,208000.0,"An eight-year-old boy is thought to be a lazy trouble-maker, until the new art teacher has the patience and compassion to discover the real problem behind his struggles in school.", Like Stars on Earth,8.0 - 8.9 (Great),2000s
175,1980,124,10,8.2,259000.0,"A Victorian surgeon rescues a heavily disfigured man who is mistreated while scraping a living as a side-show freak. Behind his monstrous façade, there is revealed a person of kindness, intelligence and sophistication.", The Elephant Man,8.0 - 8.9 (Great),1980s
207,2000,156,15,8.2,73000.0,"Three unemployed men look for answers to all their money problems - but when their opportunity arrives, will they know what to do with it?", Hera Pheri,8.0 - 8.9 (Great),2000s
244,1998,107,18,8.1,619000.0,"Eddy persuades his three pals to pool money for a vital poker game against a powerful local mobster, Hatchet Harry. Eddy loses, after which Harry gives him a week to pay back 500,000 pounds."," Lock, Stock and Two Smoking Barrels",8.0 - 8.9 (Great),1990s
290,1939,129,0,8.1,122000.0,"A naive youth leader is appointed to fill a vacancy in the U.S. Senate. His idealistic plans promptly collide with corruption at home and subterfuge from his hero in Washington, but he tries to forge ahead despite attacks on his character.", Mr,8.0 - 8.9 (Great),1930s
368,2006,117,12,8.0,565000.0,A struggling salesman takes custody of his son as he's poised to begin a life-changing professional career., The Pursuit of Happyness,8.0 - 8.9 (Great),2000s
377,1995,129,15,8.0,649000.0,"In a future world devastated by disease, a convict is sent back in time to gather information about the man-made virus that wiped out most of the human population on the planet.", Twelve Monkeys,8.0 - 8.9 (Great),1990s
415,1960,174,18,8.0,79000.0,A series of stories following a week in the life of a philandering tabloid journalist living in Rome., La dolce vita,8.0 - 8.9 (Great),1960s
577,1941,90,10,7.9,29000.0,Hollywood director John L. Sullivan sets out to experience life as a homeless person in order to gain relevant life experience for his next movie., Sullivan's Travels,7.0 - 7.9 (Good),1940s
600,2018,140,12,7.9,29000.0,"Upon realizing the extent to which women are affected by their menses, a man sets out to create a sanitary pad machine and to provide inexpensive sanitary pads to the women of rural India.", Padman,7.0 - 7.9 (Good),2010s
710,1979,123,18,7.8,36000.0,"Director/choreographer Bob Fosse tells his own life story as he details the sordid career of Joe Gideon, a womanizing, drug-using dancer.", All That Jazz,7.0 - 7.9 (Good),1970s
789,2009,95,12,7.7,562000.0,"After being dumped by the girl he believes to be his soulmate, hopeless romantic Tom Hansen reflects on their relationship to try and figure out where things went wrong and how he can win her back.", 500 Days of Summer,7.0 - 7.9 (Good),2000s
793,2003,102,15,7.7,493000.0,A faded movie star and a neglected young woman form an unlikely bond after crossing paths in Tokyo., Lost in Translation,7.0 - 7.9 (Good),2000s
833,1988,107,12,7.7,45000.0,"Rex and Saskia, a young couple in love, are on vacation. They stop at a busy service station and Saskia is abducted. After three years and no sign of Saskia, Rex begins receiving letters from the abductor.", The Vanishing,7.0 - 7.9 (Good),1980s
866,1987,84,18,7.7,183000.0,"Ash Williams, the lone survivor of an earlier onslaught of flesh-possessing spirits, holes up in a cabin with a group of strangers while the demons continue their attack.", Evil Dead II,7.0 - 7.9 (Good),1980s
938,2013,130,12,7.7,51000.0,"An Iranian man deserts his French wife and her two children to return to his homeland. Meanwhile, his wife starts up a new relationship, a reality her husband confronts upon his wife's request for a divorce.", The Past,7.0 - 7.9 (Good),2010s
952,2009,162,18,7.6,585000.0,"In a version of 1985 where superheroes exist, the murder of a colleague sends active vigilante Rorschach on the trail of a conspiracy that will change the course of history.", Watchmen,7.0 - 7.9 (Good),2000s
958,2001,101,12,7.6,395000.0,"In 1945, immediately following the end of Second World War, a woman who lives with her two photosensitive children on her darkened old family estate in the Channel Islands becomes convinced that the home is haunted.", The Others,7.0 - 7.9 (Good),2000s
959,2007,114,15,7.6,295000.0,"Two Boston area detectives investigate a little girl's kidnapping, which ultimately turns into a crisis both professionally and personally.", Gone Baby Gone,7.0 - 7.9 (Good),2000s
976,2004,101,15,7.6,417000.0,An industrial worker who hasn't slept in a year begins to doubt his own sanity., The Machinist,7.0 - 7.9 (Good),2000s
50,2014,106,15,8.5,999000.0,A promising young drummer enrolls at a cut-throat music conservatory where his dreams of greatness are mentored by an instructor who will stop at nothing to realize a student's potential., Whiplash,8.0 - 8.9 (Great),2010s
80,2016,106,12,8.4,325000.0,"Two teenagers share a profound, magical connection upon discovering they are swapping bodies. Things manage to become even more complicated when the boy and girl decide to meet in person.", Your Name,8.0 - 8.9 (Great),2010s
119,1962,218,10,8.3,316000.0,"The story of T.E. Lawrence, the English officer who successfully united and led the diverse, often warring, Arab tribes during World War I in order to fight the Turks.", Lawrence of Arabia,8.0 - 8.9 (Great),1960s
152,1976,114,18,8.2,927000.0,"A mentally unstable veteran works as a nighttime taxi driver in New York City, where the perceived decadence and sleaze fuels his urge for violent action.", Taxi Driver,8.0 - 8.9 (Great),1970s
214,2019,152,12,8.1,482000.0,American car designer Carroll Shelby and driver Ken Miles battle corporate interference and the laws of physics to build a revolutionary race car for Ford in order to defeat Ferrari at the 24 Hours of Le Mans in 1966., Le Mans '66,8.0 - 8.9 (Great),2010s
316,1988,142,15,8.1,33000.0,"In this luminous tale set in the area around Sarajevo and in Italy, Perhan, an engaging young Romany (gypsy) with telekinetic powers, is seduced by the quick-cash world of petty crime, which threatens to destroy him and those he loves.", Time of the Gypsies,8.0 - 8.9 (Great),1980s
339,2019,130,15,8.1,37000.0,"In the rural heartlands of India, an upright police officer sets out on a crusade against violent caste-based crimes and discrimination.", Article 15,8.0 - 8.9 (Great),2010s
391,2007,115,12,8.0,660000.0,Jason Bourne dodges a ruthless C.I.A. official and his Agents from a new assassination program while searching for the origins of his life as a trained killer., The Bourne Ultimatum,8.0 - 8.9 (Great),2000s
419,1998,105,15,8.0,94000.0,"At Helge's 60th birthday party, some unpleasant family truths are revealed.", The Celebration,8.0 - 8.9 (Great),1990s
458,2014,160,15,8.0,58000.0,"A young man returns to Kashmir after his father's disappearance to confront his uncle, whom he suspects of playing a role in his father's fate.", Haider,8.0 - 8.9 (Great),2010s
