Movie_Rank,year,duration_minutes,age_limit,rating,Number_of_ratings,description,Title,rating_category,decade
680,2005,136,12,7.8,267000.0,"A chronicle of country music legend Johnny Cash's life, from his early days on an Arkansas cotton farm to his rise to fame with Sun Records in Memphis, where he recorded alongside Elvis Presley, Jerry Lee Lewis, and Carl Perkins.", Walk the Line,7.0 - 7.9 (Good),2000s
834,2013,91,12,7.7,866000.0,"Dr Ryan Stone, an engineer on her first time on a space mission, and Matt Kowalski, an astronaut on his final expedition, have to survive in space after they are hit by debris while spacewalking.", Gravity,7.0 - 7.9 (Good),2010s
907,2016,96,Unknown,7.7,72000.0,"Seven long-time friends meet for dinner. They decide to share their text messages, emails and phone calls. Secrets are unveiled. Harmony trembles.", Perfect Strangers,7.0 - 7.9 (Good),2010s
950,2018,119,15,7.6,652000.0,"Foul-mouthed mutant mercenary Wade Wilson (a.k.a. Deadpool) assembles a team of fellow mutant rogues to protect a young boy with abilities from the brutal, time-traveling cyborg Cable.", Deadpool 2,7.0 - 7.9 (Good),2010s
953,1998,81,15,7.6,208000.0,"After a botched money delivery, Lola has 20 minutes to come up with 100,000 Deutschmarks.", Run Lola Run,7.0 - 7.9 (Good),1990s
108,1992,99,18,8.3,1100000.0,"When a simple jewelry heist goes horribly wrong, the surviving criminals begin to suspect that one of them is a police informant.", Reservoir Dogs,8.0 - 8.9 (Great),1990s
351,2013,126,15,8.0,675000.0,"In a near future, a lonely writer develops an unlikely relationship with an operating system designed to meet his every need.", Her,8.0 - 8.9 (Great),2010s
406,1971,181,0,8.0,48000.0,"In pre-revolutionary Russia, a Jewish peasant with traditional values contends with marrying off three of his daughters with modern romantic ideals while growing anti-Semitic sentiment threatens his village.", Fiddler on the Roof,8.0 - 8.9 (Great),1970s
468,2016,184,10,8.0,69000.0,The untold story of Mahendra Singh Dhoni's journey from ticket collector to trophy collector - the world-cup-winning captain of the Indian Cricket Team., M,8.0 - 8.9 (Great),2010s
520,1948,80,10,7.9,155000.0,Two men try to convince themselves they've committed the perfect murder by hosting a dinner party after strangling a former classmate to death., Rope,7.0 - 7.9 (Good),1940s
564,1970,113,18,7.9,34000.0,"A weak-willed Italian man becomes a fascist flunky who goes abroad to arrange the assassination of his old teacher, now a political dissident.", The Conformist,7.0 - 7.9 (Good),1970s
596,2018,124,12,7.9,38000.0,A man is embarrassed when he finds out his mother is pregnant., Badhaai Ho,7.0 - 7.9 (Good),2010s
624,2016,133,13,7.8,691000.0,"In a time of conflict, a group of unlikely heroes band together on a mission to steal the plans to the Death Star, the Empire's ultimate weapon of destruction.", Rogue One,7.0 - 7.9 (Good),2010s
669,1989,122,15,7.8,145000.0,"Robert Gould Shaw leads the U.S. Civil War's first all-black volunteer company, fighting prejudices from both his own Union Army, and the Confederates.", Glory,7.0 - 7.9 (Good),1980s
670,2015,147,15,7.8,220000.0,"The rap group NWA emerges from the mean streets of Compton in Los Angeles, California, in the mid-1980s and revolutionizes Hip Hop culture with their music and tales about life in the hood.", Straight Outta Compton,7.0 - 7.9 (Good),2010s
685,1989,103,0,7.8,167000.0,"A young witch, on her mandatory year of independent life, finds fitting into a new community difficult while she supports herself by running an air courier service.", Kiki's Delivery Service,7.0 - 7.9 (Good),1980s
720,1932,64,-1,7.8,51000.0,"A circus' beautiful trapeze artist Cleopatra agrees to marry Hans the leader of side-show performers, but Hans' deformed friends discover that she is only marrying him for his inheritance. So they seek revenge.", Freaks,7.0 - 7.9 (Good),1930s
906,1956,80,10,7.7,55000.0,A small-town doctor learns that the population of his community is being replaced by emotionless alien duplicates., Invasion of the Body Snatchers,7.0 - 7.9 (Good),1950s
908,1991,129,15,7.7,66000.0,An anthology of 5 different cab drivers in 5 American and European cities and their remarkable fares on the same eventful night., Night on Earth,7.0 - 7.9 (Good),1990s
965,2011,133,12,7.6,468000.0,Oakland A's general manager Billy Beane's successful attempt to assemble a baseball team on a lean budget by employing computer-generated analysis to acquire new players., Moneyball,7.0 - 7.9 (Good),2010s
82,2006,137,15,8.4,412000.0,"In 1984 East Berlin, an agent of the secret police conducting surveillance on a writer and his lover finds himself becoming increasingly absorbed by their lives.", The Lives of Others,8.0 - 8.9 (Great),2000s
149,2018,130,12,8.2,579000.0,A working-class Italian-American bouncer becomes the driver for an African-American classical pianist on a tour of venues through the 1960s American South., Green Book,8.0 - 8.9 (Great),2010s
189,1948,126,10,8.2,133000.0,Two down-on-their-luck Americans searching for work in 1920s Mexico convince an old prospector to help them mine for gold in the Sierra Madre Mountains., The Treasure of the Sierra Madre,8.0 - 8.9 (Great),1940s
202,1975,142,0,8.2,34000.0,The Russian army sends an explorer on an expedition to the snowy Siberian wilderness where he makes friends with a seasoned local hunter., Dersu Uzala,8.0 - 8.9 (Great),1970s
255,1984,145,15,8.1,120000.0,"Travis Henderson, an aimless drifter who has been missing for four years, wanders out of the desert and must reconnect with society, himself, his life, and his family."," Paris, Texas",8.0 - 8.9 (Great),1980s
315,2004,117,13,8.1,26000.0,A young couple's enduring love is tested when 27-year-old Su-jin is diagnosed with a rare form of Alzheimer's disease., A Moment to Remember,8.0 - 8.9 (Great),2000s
371,1999,188,18,8.0,330000.0,"An epic mosaic of interrelated characters in search of love, forgiveness and meaning in the San Fernando Valley.", Magnolia,8.0 - 8.9 (Great),1990s
448,2003,103,15,8.0,87000.0,A boy is raised by a Buddhist monk in an isolated floating temple where the years pass like the seasons.," Spring, Summer, Fall, Winter",8.0 - 8.9 (Great),2000s
516,1984,82,15,7.9,148000.0,"Spinal Tap, one of England's loudest bands, is chronicled by film director Marty DiBergi on what proves to be a fateful tour.", This Is Spinal Tap,7.0 - 7.9 (Good),1980s
715,1996,159,18,7.8,72000.0,"Oilman Jan is paralyzed in an accident. His wife, who prayed for his return, feels guilty; even more, when Jan urges her to have sex with another.", Breaking the Waves,7.0 - 7.9 (Good),1990s
764,2012,134,10,7.8,40000.0,"A quiet, sweet tempered housewife endures small slights from her well-educated husband and daughter every day because of her inability to speak and understand English.", English Vinglish,7.0 - 7.9 (Good),2010s
835,1989,95,15,7.7,244000.0,"Harry and Sally have known each other for years, and are very good friends, but they fear sex would ruin the friendship.", When Harry Met Sally,7.0 - 7.9 (Good),1980s
846,2006,101,18,7.7,129000.0,"A young boy becomes friends with a gang of skinheads. Friends soon become like family, and relationships will be pushed to the very limit.", This Is England,7.0 - 7.9 (Good),2000s
900,2010,119,18,7.7,75000.0,A quiet pawnshop keeper with a violent past takes on a drug-and-organ trafficking ring in hope of saving the child who is his only friend., The Man from Nowhere,7.0 - 7.9 (Good),2010s
16,2014,169,12,8.7,2100000.0,"When Earth becomes uninhabitable in the future, a farmer and ex-NASA pilot, Joseph Cooper, is tasked to pilot a spacecraft, along with a team of researchers, to find a new planet for humans.", Interstellar,8.0 - 8.9 (Great),2010s
136,2022,175,15,8.3,75000.0,"A special investigator discovers a case of serial killings is not what it seems to be, and leading down this path is only going to end in a war between everyone involved.", Vikram,8.0 - 8.9 (Great),2020s
139,2013,160,12,8.3,44000.0,A man goes to extreme lengths to save his family from punishment after the family commits an accidental crime., Drishyam,8.0 - 8.9 (Great),2010s
161,2005,132,15,8.2,1200000.0,"In a future British dystopian society, a shadowy freedom fighter, known only by the alias of ""V"", plots to overthrow the tyrannical government - with the help of a young woman.", V for Vendetta,8.0 - 8.9 (Great),2000s
177,1965,132,15,8.2,276000.0,"Two bounty hunters with the same intentions team up to track down a gang of outlaws led by a psychotic Mexican bandit, who is plotting an audacious bank robbery.", For a Few Dollars More,8.0 - 8.9 (Great),1960s
192,2022,140,15,8.2,45000.0,A gripping tale of an investigation and a family which is threatened by it. Will Vijay Salgaonkar be able to protect his family this time?, Drishyam 2,8.0 - 8.9 (Great),2020s
193,2017,125,15,8.2,44000.0,"Sergeant Süleyman finds a little girl on a battlefield during the Korean War. He takes her and names her Ayla. Fifteen months later, Süleyman's brigade is told they will be returning to Turkey, and he is reluctant to leave her behind.", Ayla,8.0 - 8.9 (Great),2010s
198,1955,125,0,8.2,39000.0,"Impoverished priest Harihar Ray, dreaming of a better life for himself and his family, leaves his rural Bengal village in search of work.", Pather Panchali,8.0 - 8.9 (Great),1950s
250,2013,134,15,8.1,744000.0,"In the antebellum United States, Solomon Northup, a free Black man from upstate New York, is abducted and sold into slavery.", 12 Years a Slave,8.0 - 8.9 (Great),2010s
269,1967,127,18,8.1,189000.0,"A laid-back Southern man is sentenced to two years in a rural prison, but refuses to conform.", Cool Hand Luke,8.0 - 8.9 (Great),1960s
285,2009,92,12,8.1,187000.0,"In 1976 Melbourne, a lonely 8-year-old girl strikes up a correspondence with an unlikely pen pal: a severely obese 44-year-old New Yorker with Asperger's syndrome.", Mary and Max,8.0 - 8.9 (Great),2000s
314,1957,110,10,8.1,52000.0,A waifish prostitute wanders the streets of Rome looking for true love but finds only heartbreak., Nights of Cabiria,8.0 - 8.9 (Great),1950s
350,2001,113,15,8.0,854000.0,"After narrowly escaping a bizarre accident, a troubled teenager is plagued by visions of a man in a large rabbit suit who manipulates him to commit a series of crimes.", Donnie Darko,8.0 - 8.9 (Great),2000s
353,1968,112,10,8.0,198000.0,An astronaut crew crash-lands on a planet where highly intelligent non-human ape species are dominant and humans are enslaved., Planet of the Apes,8.0 - 8.9 (Great),1960s
373,2021,111,12,8.0,166000.0,"As a CODA (Child of Deaf Adults) Ruby is the only hearing person in her deaf family. When the family's fishing business is threatened, Ruby finds herself torn between pursuing her passion at Berklee College of Music and her fear of abandoning her parents.", CODA,8.0 - 8.9 (Great),2020s
402,1953,118,0,8.0,148000.0,A bored and sheltered princess escapes her guardians and falls in love with an American newsman in Rome., Roman Holiday,8.0 - 8.9 (Great),1950s
432,2007,112,12,8.0,111000.0,The true story of Elle editor Jean-Dominique Bauby who suffers a stroke and has to live with an almost totally paralyzed body; only his left eye isn't paralyzed., The Diving Bell and the Butterfly,8.0 - 8.9 (Great),2000s
552,1994,102,18,7.9,37000.0,A family descended from Maori warriors is bedeviled by a violent father and the societal problems of being treated as outcasts., Once Were Warriors,7.0 - 7.9 (Good),1990s
593,2009,144,15,7.9,32000.0,"After breaking up with his childhood sweetheart, a young man finds solace in drugs. Meanwhile, a teenage girl is caught in the world of prostitution. Will they be destroyed, or will they find redemption?", Dev,7.0 - 7.9 (Good),2000s
641,2022,102,10,7.8,179000.0,"When Puss in Boots discovers that his passion for adventure has taken its toll and he has burned through eight of his nine lives, he launches an epic journey to restore them by finding the mythical Last Wish.", Puss in Boots: The Last Wish,7.0 - 7.9 (Good),2020s
661,2003,154,15,7.8,474000.0,"In 19th century Japan, Nathan Algren, a US army captain, is hired by the Japanese emperor to train his army in the modern warfare techniques. Captain Algren finds himself trapped in a struggle between two eras and two worlds.", The Last Samurai,7.0 - 7.9 (Good),2000s
665,2010,144,18,7.8,147000.0,A secret agent exacts revenge on a serial killer through a series of captures and releases., I Saw the Devil,7.0 - 7.9 (Good),2010s
696,2009,152,18,7.8,224000.0,A journalist is aided by a young female hacker in his search for the killer of a woman who has been dead for forty years., The Girl with the Dragon Tattoo,7.0 - 7.9 (Good),2000s
735,1944,100,0,7.8,38000.0,"During World War II, American expatriate Harry Morgan helps transport a French Resistance leader and his beautiful wife to Martinique while romancing a sensuous lounge singer.", To Have and Have Not,7.0 - 7.9 (Good),1940s
780,2005,157,12,7.7,685000.0,"Harry Potter finds himself competing in a hazardous tournament between rival schools of magic, but he is distracted by recurring nightmares.", Harry Potter and the Goblet of Fire,7.0 - 7.9 (Good),2000s
830,1991,130,10,7.7,84000.0,"Evelyn, an ordinary housewife, visits a nursing home and befriends the old lady Ninny. Together, they bond over stories from the past about two intrepid women of Whistle Stop Cafe.", Fried Green Tomatoes at the Whistle Stop Cafe,7.0 - 7.9 (Good),1990s
864,1985,154,15,7.7,98000.0,"A tale spanning forty years in the life of Celie, an African-American woman living in the South who survives incredible abuse and bigotry.", The Color Purple,7.0 - 7.9 (Good),1980s
897,2018,189,15,7.7,26000.0,"German artist Kurt Barnert has escaped East Germany and now lives in West Germany, but is tormented by his childhood under the Nazis and the GDR-regime.", Never Look Away,7.0 - 7.9 (Good),2010s
898,1992,94,10,7.7,103000.0,"In 1930s Italy, a veteran World War I pilot is cursed to look like an anthropomorphic pig.", Porco Rosso,7.0 - 7.9 (Good),1990s
937,2005,94,17,7.7,55000.0,A neo-Nazi sentenced to community service at a church clashes with the blindly devoted minister., Adam's Apples,7.0 - 7.9 (Good),2000s
964,1987,102,18,7.6,285000.0,"In a dystopic and crime-ridden Detroit, a terminally wounded cop returns to the force as a powerful cyborg haunted by submerged memories.", RoboCop,7.0 - 7.9 (Good),1980s
104,1971,136,18,8.3,885000.0,"In the future, a sadistic gang leader is imprisoned and volunteers for a conduct-aversion experiment, but it doesn't go as planned.", A Clockwork Orange,8.0 - 8.9 (Great),1970s
156,1982,109,18,8.2,470000.0,A research team in Antarctica is hunted by a shape-shifting alien that assumes the appearance of its victims., The Thing,8.0 - 8.9 (Great),1980s
159,1988,132,18,8.2,950000.0,A New York City police officer tries to save his estranged wife and several others taken hostage by terrorists during a Christmas party at the Nakatomi Plaza in Los Angeles., Die Hard,8.0 - 8.9 (Great),1980s
306,1960,128,18,8.1,33000.0,"Based on a real-life case in 1925; two great lawyers argue the case for, and against, a Tennessee science teacher accused of the crime of teaching Darwin's theory of evolution.", Inherit the Wind,8.0 - 8.9 (Great),1960s
389,2003,178,15,8.0,159000.0,"A woman on the run from the mob is reluctantly accepted in a small Colorado community in exchange for labor, but when a search visits the town she finds out that their support has a price.", Dogville,8.0 - 8.9 (Great),2000s
436,2014,93,10,8.0,63000.0,"Ben, a young Irish boy, and his little sister Saoirse, a girl who can turn into a seal, go on an adventure to free the fairies and save the spirit world.", Song of the Sea,8.0 - 8.9 (Great),2010s
463,1962,96,10,8.0,41000.0,"A crafty samurai helps a young man and his fellow clansmen trying to save his uncle, who has been framed and imprisoned by a corrupt superintendent.", Sanjuro,8.0 - 8.9 (Great),1960s
479,1982,115,0,7.9,440000.0,A troubled child summons the courage to help a friendly alien escape from Earth and return to his home planet., E,7.0 - 7.9 (Good),1980s
505,2004,99,15,7.9,597000.0,"The uneventful, aimless lives of a London electronics salesman and his layabout roommate are disrupted by the zombie apocalypse.", Shaun of the Dead,7.0 - 7.9 (Good),2000s
506,1980,133,18,7.9,216000.0,"Jake Blues rejoins with his brother Elwood after being released from prison, but the duo has just days to reunite their old R&B band and save the Catholic home where the two were raised, outrunning the police as they tear through Chicago.", The Blues Brothers,7.0 - 7.9 (Good),1980s
553,1946,114,10,7.9,91000.0,"Private detective Philip Marlowe is hired by a wealthy family. Before the complex case is over, he's seen murder, blackmail and what might be love.", The Big Sleep,7.0 - 7.9 (Good),1940s
563,1950,104,0,7.9,58000.0,"Due to his insistence that he has an invisible six foot-tall rabbit for a best friend, a whimsical middle-aged man is thought by his family to be insane - but he may be wiser than anyone knows.", Harvey,7.0 - 7.9 (Good),1950s
576,2004,121,18,7.9,58000.0,"With the intention to break free from the strict familial restrictions, a suicidal young woman sets up a marriage of convenience with a forty-year-old addict, an act that will lead to an outburst of envious love.", Head-On,7.0 - 7.9 (Good),2000s
584,2001,98,15,7.9,49000.0,"Bosnia and Herzegovina during 1993 at the time of the heaviest fighting between the two warring sides. Two soldiers from opposing sides in the conflict, Nino and Ciki, become trapped in no man's land, whilst a third soldier becomes a living booby trap.", No Man's Land,7.0 - 7.9 (Good),2000s
604,1985,97,15,7.8,439000.0,Five high school students meet in Saturday detention and discover how they have a great deal more in common than they thought., The Breakfast Club,7.0 - 7.9 (Good),1980s
663,2016,101,12,7.8,143000.0,A national manhunt is ordered for a rebellious kid and his foster uncle who go missing in the wild New Zealand bush., Hunt for the Wilderpeople,7.0 - 7.9 (Good),2010s
707,1948,133,0,7.8,35000.0,"Dunson leads a cattle drive, the culmination of over 14 years of work, to its destination in Missouri. But his tyrannical behavior along the way causes a mutiny, led by his adopted son.", Red River,7.0 - 7.9 (Good),1940s
734,2009,155,18,7.8,103000.0,A delinquent Muslim man struggles to get by in prison until he is taken under the wing of a powerful mob boss. But his gradual rise through the mob's ranks brings him in conflict with his mentor., A Prophet,7.0 - 7.9 (Good),2000s
791,2022,114,15,7.7,256000.0,"Two lifelong friends find themselves at an impasse when one abruptly ends their relationship, with alarming consequences for both of them.", The Banshees of Inisherin,7.0 - 7.9 (Good),2020s
871,2006,90,15,7.7,98000.0,"When a machine that allows therapists to enter their patients' dreams is stolen, all hell breaks loose. Only a young female therapist, Paprika, can stop it.", Paprika,7.0 - 7.9 (Good),2000s
956,2022,102,12,7.6,96000.0,Sophie reflects on the shared joy and private melancholy of a holiday she took with her father twenty years earlier. Memories real and imagined fill the gaps between as she tries to reconcile the father she knew with the man she didn't..., Aftersun,7.0 - 7.9 (Good),2020s
55,1942,102,0,8.5,609000.0,A cynical expatriate American cafe owner struggles to decide whether or not to help his former lover and her fugitive husband escape the Nazis in French Morocco., Casablanca,8.0 - 8.9 (Great),1940s
208,2017,147,12,8.2,51000.0,"Vikram, a no-nonsense police officer, accompanied by Simon, his partner, is on the hunt to capture Vedha, a smuggler and a murderer. Vedha tries to change Vikram's life, which leads to a conflict.", Vikram Vedha,8.0 - 8.9 (Great),2010s
233,1996,93,18,8.1,729000.0,"Renton, deeply immersed in the Edinburgh drug scene, tries to clean up and get out despite the allure of drugs and the influence of friends.", Trainspotting,8.0 - 8.9 (Great),1990s
242,2011,140,12,8.1,500000.0,"The youngest son of an alcoholic former boxer returns home, where he's trained by his father for competition in a mixed martial arts tournament - a path that puts the fighter on a collision course with his estranged, older brother.", Warrior,8.0 - 8.9 (Great),2010s
257,1988,86,0,8.1,383000.0,"When two girls move to the country to be near their ailing mother, they have adventures with the wondrous forest spirits who live nearby.", My Neighbour Totoro,8.0 - 8.9 (Great),1980s
259,2004,80,15,8.1,290000.0,"Nine years after Jesse and Celine first met, they encounter each other again on the French leg of Jesse's book tour.", Before Sunset,8.0 - 8.9 (Great),2000s
267,1999,86,10,8.1,229000.0,A young boy befriends a giant robot from outer space that a paranoid government agent wants to destroy., The Iron Giant,8.0 - 8.9 (Great),1990s
434,1998,169,15,8.0,69000.0,"A baby boy discovered on an ocean liner in 1900 grows into a musical prodigy, never setting foot on land.", The Legend of 1900,8.0 - 8.9 (Great),1990s
486,2009,162,12,7.9,1400000.0,A paraplegic Marine dispatched to the moon Pandora on a unique mission becomes torn between following his orders and protecting the world he feels is his home., Avatar,7.0 - 7.9 (Good),2000s
601,2024,148,15,7.8,85000.0,The origin story of renegade warrior Furiosa before her encounter and teamup with Mad Max., Furiosa: A Mad Max Saga,7.0 - 7.9 (Good),2020s
726,1950,112,10,7.8,30000.0,"A major heist goes off as planned, but then double crosses, bad luck and solid police work cause everything to unravel.", The Asphalt Jungle,7.0 - 7.9 (Good),1950s
730,1943,108,10,7.8,71000.0,"A teenage girl, overjoyed when her favorite uncle comes to visit the family in their quiet California town, slowly begins to suspect that he is in fact the ""Merry Widow"" killer sought by the authorities.", Shadow of a Doubt,7.0 - 7.9 (Good),1940s
766,2001,95,15,7.7,37000.0,A gender-queer punk-rock singer from East Berlin tours the U.S. with her band as she tells her life story and follows the former lover/band-mate who stole her songs., Hedwig and the Angry Inch,7.0 - 7.9 (Good),2000s
825,1995,136,0,7.7,126000.0,"Rich Mr. Dashwood dies, leaving his second wife and her three daughters poor by the rules of inheritance. The two eldest daughters are the title opposites.", Sense and Sensibility,7.0 - 7.9 (Good),1990s
77,1981,115,10,8.4,1000000.0,"In 1936, archaeologist and adventurer Indiana Jones is hired by the U.S. government to find the Ark of the Covenant before the Nazis can obtain its awesome powers.", Raiders of the Lost Ark,8.0 - 8.9 (Great),1980s
151,1998,103,10,8.2,1200000.0,An insurance salesman discovers his whole life is actually a reality TV show., The Truman Show,8.0 - 8.9 (Great),1990s
171,1975,91,12,8.2,572000.0,"King Arthur and his Knights of the Round Table embark on a surreal, low-budget search for the Holy Grail, encountering many, very silly obstacles.", Monty Python and the Holy Grail,8.0 - 8.9 (Great),1970s
179,2020,117,15,8.2,74000.0,"After his family was brutally murdered and his sister turned into a demon, Tanjiro Kamado's journey as a demon slayer began. Tanjiro and his comrades embark on a new mission aboard the Mugen Train, on track to despair.", Demon Slayer: Kimetsu no Yaiba - The Movie: Mugen Train,8.0 - 8.9 (Great),2020s
206,1952,89,10,8.2,28000.0,An elderly man and his dog struggle to survive on his government pension in Rome., Umberto D,8.0 - 8.9 (Great),1950s
310,1926,78,0,8.1,99000.0,"After being rejected by the Confederate military, not realizing it was due to his crucial civilian role, an engineer must single-handedly recapture his beloved locomotive after it is seized by Union spies and return it through enemy lines.", The General,8.0 - 8.9 (Great),1920s
369,1975,125,18,8.0,274000.0,"Three amateur bank robbers plan to hold up a bank. A nice simple robbery: Walk in, take the money, and run. Unfortunately, the supposedly uncomplicated heist suddenly becomes a bizarre nightmare as everything that could go wrong does.", Dog Day Afternoon,8.0 - 8.9 (Great),1970s
376,1992,90,0,8.0,470000.0,A kind-hearted street urchin and a power-hungry Grand Vizier vie for a magic lamp that has the power to make their deepest wishes come true., Aladdin,8.0 - 8.9 (Great),1990s
425,1920,58,10,8.0,70000.0,"Hypnotist Dr. Caligari uses a somnambulist, Cesare, to commit murders.", The Cabinet of Dr,8.0 - 8.9 (Great),1920s
429,1982,158,10,8.0,39000.0,"The story of Brian Sweeney Fitzgerald, an extremely determined man who intends to build an opera house in the middle of a jungle.", Fitzcarraldo,8.0 - 8.9 (Great),1980s
431,1974,155,18,8.0,29000.0,"Although wife and mother Mabel is loved by her husband Nick, her mental illness places a strain on the marriage.", A Woman Under the Influence,8.0 - 8.9 (Great),1970s
473,2017,113,10,7.9,180000.0,"Based on the New York Times bestseller, this movie tells the incredibly inspiring and heartwarming story of August Pullman, a boy with facial differences who enters the fifth grade, attending a mainstream elementary school for the first time.", Wonder,7.0 - 7.9 (Good),2010s
493,2009,127,12,7.9,622000.0,The brash James T. Kirk tries to live up to his father's legacy with Mr. Spock keeping him in check as a vengeful Romulan from the future creates black holes to destroy the Federation one planet at a time., Star Trek,7.0 - 7.9 (Good),2000s
627,2017,132,15,7.8,319000.0,"In 1980s Italy, romance blossoms between a seventeen-year-old student and the older man hired as his father's research assistant.", Call Me by Your Name,7.0 - 7.9 (Good),2010s
737,1938,102,0,7.8,66000.0,"While trying to secure a $1 million donation for his museum, a befuddled paleontologist is pursued by a flighty and often irritating heiress and her pet leopard, Baby.", Bringing Up Baby,7.0 - 7.9 (Good),1930s
