Movie_Rank,year,duration_minutes,age_limit,rating,Number_of_ratings,description,Title,rating_category,decade
980,2011,94,12,7.6,451000.0,"While on a trip to Paris with his fiancée's family, a nostalgic screenwriter finds himself mysteriously going back to the 1920s every day at midnight.", Midnight in Paris,7.0 - 7.9 (Good),2010s
22,2020,153,15,8.7,124000.0,"Nedumaaran Rajangam ""Maara"" sets out to make the common man fly and in the process takes on the world's most capital intensive industry and several enemies who stand in his way.", Soorarai Pottru,8.0 - 8.9 (Great),2020s
111,2020,160,12,8.3,115000.0,"The real life of one of America's foremost founding fathers and first Secretary of the Treasury, Alexander Hamilton. Captured live on Broadway from the Richard Rodgers Theater with the original Broadway cast.", Hamilton,8.0 - 8.9 (Great),2020s
117,1931,117,10,8.3,169000.0,"When the police in a German city are unable to catch a child-murderer, other criminals join in the manhunt.", M,8.0 - 8.9 (Great),1930s
158,2003,100,0,8.2,1100000.0,"After his son is captured in the Great Barrier Reef and taken to Sydney, a timid clownfish sets out on a journey to bring him home.", Finding Nemo,8.0 - 8.9 (Great),2000s
183,2012,321,18,8.2,104000.0,"A clash between Sultan and Shahid Khan leads to the expulsion of Khan from Wasseypur, and ignites a deadly blood feud spanning three generations.", Gangs of Wasseypur,8.0 - 8.9 (Great),2010s
187,2018,139,12,8.2,103000.0,"A series of mysterious events change the life of a blind pianist, who must now report a crime that he should technically know nothing of.", Andhadhun,8.0 - 8.9 (Great),2010s
211,2015,95,0,8.1,795000.0,"After young Riley is uprooted from her Midwest life and moved to San Francisco, her emotions - Joy, Fear, Anger, Disgust and Sadness - conflict on how best to navigate a new city, house, and school.", Inside Out,8.0 - 8.9 (Great),2010s
238,2013,123,15,8.1,516000.0,The merciless 1970s rivalry between Formula One rivals James Hunt and Niki Lauda., Rush,8.0 - 8.9 (Great),2010s
275,1976,121,18,8.1,171000.0,"A television network cynically exploits a deranged former anchor's ravings and revelations about the news media for its own profit, but finds that his message may be difficult to control.", Network,8.0 - 8.9 (Great),1970s
277,1997,87,15,8.1,65000.0,Concurrent theatrical ending of the TV series Neon Genesis Evangelion (1995)., Neon Genesis Evangelion: The End of Evangelion,8.0 - 8.9 (Great),1990s
291,1948,135,10,8.1,39000.0,A young ballet dancer is torn between the man she loves and her pursuit to become a prima ballerina., The Red Shoes,8.0 - 8.9 (Great),1940s
320,2008,104,15,8.1,83000.0,A retiring police officer reminisces about the most astounding day of his career. About a case that was never filed but continues to haunt him in his memories - the case of a man and a Wednesday., A Wednesday,8.0 - 8.9 (Great),2000s
455,1987,104,10,8.0,36000.0,"A French boarding school run by priests seems to be a haven from World War II until a new student arrives. Occupying the next bed in the dormitory to the top student in his class, the two young boys begin to form a bond.", Au Revoir les Enfants,8.0 - 8.9 (Great),1980s
566,2012,127,12,7.9,106000.0,"Georges and Anne are an octogenarian couple. They are cultivated, retired music teachers. Their daughter, also a musician, lives in Britain with her family. One day, Anne has a stroke, and the couple's bond of love is severely tested.", Amour,7.0 - 7.9 (Good),2010s
628,1993,121,18,7.8,163000.0,"An intense drama about a boy torn between his tough, hard-working father and a violent yet charismatic crime boss.", A Bronx Tale,7.0 - 7.9 (Good),1990s
631,2015,168,18,7.8,664000.0,"In the dead of a Wyoming winter, a bounty hunter and his prisoner find shelter in a cabin currently inhabited by a collection of nefarious characters.", The Hateful Eight,7.0 - 7.9 (Good),2010s
653,2008,166,12,7.8,699000.0,"Tells the story of Benjamin Button, a man who starts aging backwards with consequences.", The Curious Case of Benjamin Button,7.0 - 7.9 (Good),2000s
664,1990,107,18,7.8,237000.0,"After a famous author is rescued from a car crash by a fan of his novels, he comes to realize that the care he is receiving is only the beginning of a nightmare of captivity and abuse.", Misery,7.0 - 7.9 (Good),1990s
684,2021,105,15,7.8,39000.0,"The prequel to Jujutsu Kaisen (2020), where a high schooler gains control of an extremely powerful cursed spirit and gets enrolled in the Tokyo Prefectural Jujutsu High School by Jujutsu Sorcerers.", Jujutsu Kaisen 0: The Movie,7.0 - 7.9 (Good),2020s
741,2001,115,12,7.8,53000.0,"A terrorist explosion releases a deadly virus on the masses, and it's up to the bounty-hunting Bebop crew to catch the cold-blooded culprit.", Cowboy Bebop: The Movie,7.0 - 7.9 (Good),2000s
767,1962,178,10,7.7,60000.0,"The events of D-Day, told on a grand scale from both the Allied and German points of view.", The Longest Day,7.0 - 7.9 (Good),1960s
858,2015,105,12,7.7,139000.0,"High schooler Greg, who spends most of his time making parodies of classic movies with his co-worker Earl, finds his outlook forever altered after befriending a classmate who has just been diagnosed with cancer.", Me and Earl and the Dying Girl,7.0 - 7.9 (Good),2010s
867,2020,129,15,7.7,194000.0,"The story of 7 people on trial stemming from various charges surrounding the uprising at the 1968 Democratic National Convention in Chicago, Illinois.", The Trial of the Chicago 7,7.0 - 7.9 (Good),2020s
915,1946,97,18,7.7,26000.0,"After their cattle are stolen and their brother murdered, the Earp brothers have a score to settle with the Clanton family.", My Darling Clementine,7.0 - 7.9 (Good),1940s
60,1931,87,0,8.5,197000.0,"With the aid of a wealthy erratic tippler, a dewy-eyed tramp who has fallen in love with a sightless flower girl accumulates money to be able to help her medically.", City Lights,8.0 - 8.9 (Great),1930s
86,1957,116,0,8.4,139000.0,A veteran British barrister must defend his client in a murder trial that has surprise after surprise., Witness for the Prosecution,8.0 - 8.9 (Great),1950s
93,2023,180,15,8.3,755000.0,The story of American scientist J. Robert Oppenheimer and his role in the development of the atomic bomb., Oppenheimer,8.0 - 8.9 (Great),2020s
102,1984,229,18,8.3,380000.0,"A former Prohibition-era Jewish gangster returns to the Lower East Side of Manhattan 35 years later, where he must once again confront the ghosts and regrets of his old life.", Once Upon a Time in America,8.0 - 8.9 (Great),1980s
133,1948,89,0,8.3,176000.0,"In post-war Italy, a working-class man's bicycle is stolen, endangering his efforts to find work. He and his son set out to find it.", Bicycle Thieves,8.0 - 8.9 (Great),1940s
224,1973,122,18,8.1,458000.0,"When a young girl is possessed by a mysterious entity, her mother seeks the help of two Catholic priests to save her life.", The Exorcist,8.0 - 8.9 (Great),1970s
284,1934,105,18,8.1,113000.0,A rogue reporter trailing a runaway heiress for a big story joins her on a bus heading from Florida to New York and they end up stuck with each other when the bus leaves them behind at one of the stops along the way., It Happened One Night,8.0 - 8.9 (Great),1930s
329,1996,128,15,8.1,72000.0,"Baran the Bandit, released from prison after 35 years, searches for vengeance and his lover.", The Bandit,8.0 - 8.9 (Great),1990s
397,1959,161,18,8.0,72000.0,"An upstate Michigan lawyer defends a soldier who claims he killed an innkeeper due to temporary insanity after the victim raped his wife. What is the truth, and will he win his case?", Anatomy of a Murder,8.0 - 8.9 (Great),1950s
490,2001,90,0,7.9,739000.0,"A mean lord exiles fairytale creatures to the swamp of a grumpy ogre, who must go on a quest and rescue a princess for the lord in order to get his land back.", Shrek,7.0 - 7.9 (Good),2000s
529,1969,145,18,7.9,91000.0,"An aging group of outlaws look for one last big score as the ""traditional"" American West is disappearing around them.", The Wild Bunch,7.0 - 7.9 (Good),1960s
599,2015,159,15,7.9,61000.0,"An elite counter-intelligence unit learns of a plot, masterminded by a maniacal madman. With the clock ticking, it's up to them to track the terrorists' international tentacles and prevent them from striking at the heart of India.", Baby,7.0 - 7.9 (Good),2010s
743,2004,97,12,7.8,67000.0,"Pierre, a successful orchestra conductor, returns home when his mother dies. He stumbles upon an old diary and recollects the childhood school memories and his music teacher Clement Mathieu.", The Chorus,7.0 - 7.9 (Good),2000s
819,2004,112,15,7.7,450000.0,"Los Angeles citizens with vastly separate lives collide in interweaving stories of race, loss and redemption.", Crash,7.0 - 7.9 (Good),2000s
892,1982,129,18,7.7,46000.0,"An outcast, alcoholic Boston lawyer sees the chance to salvage his career and self-respect by taking a medical malpractice case to trial rather than settling.", The Verdict,7.0 - 7.9 (Good),1980s
910,1941,118,18,7.7,27000.0,"At the turn of the century in a Welsh mining village, the Morgans, he stern, she gentle, raise coal-mining sons and hope their youngest will find a better life.", How Green Was My Valley,7.0 - 7.9 (Good),1940s
967,2016,102,15,7.6,254000.0,"Toby is a divorced father who's trying to make a better life. His brother is an ex-con with a short temper and a loose trigger finger. Together, they plan a series of heists against the bank that's about to foreclose on their family ranch.", Hell or High Water,7.0 - 7.9 (Good),2010s
13,1994,142,12,8.8,2300000.0,"The history of the United States from the 1950s to the '70s unfolds from the perspective of an Alabama man with an IQ of 75, who yearns to be reunited with his childhood sweetheart.", Forrest Gump,8.0 - 8.9 (Great),1990s
25,2024,166,12,8.6,450000.0,Paul Atreides unites with Chani and the Fremen while seeking revenge against the conspirators who destroyed his family., Dune: Part Two,8.0 - 8.9 (Great),2020s
54,1954,112,10,8.5,525000.0,"A wheelchair-bound photographer spies on his neighbors from his Greenwich Village courtyard apartment window and, despite the skepticism of his fashion-model girlfriend, becomes convinced one of them has committed murder.", Rear Window,8.0 - 8.9 (Great),1950s
63,2018,158,10,8.5,37000.0,Two high school sweethearts meet at a reunion after 22 years and reminisce about their past.,96,8.0 - 8.9 (Great),2010s
75,1950,110,10,8.4,238000.0,A screenwriter develops a dangerous relationship with a faded film star determined to make a triumphant return., Sunset Blvd,8.0 - 8.9 (Great),1950s
124,1959,136,10,8.3,348000.0,"A New York City advertising executive goes on the run after being mistaken for a government agent by a group of foreign spies, and falls for a woman whose loyalties he begins to doubt.", North by Northwest,8.0 - 8.9 (Great),1950s
181,1950,88,18,8.2,181000.0,"The rape of a bride and the murder of her samurai husband are recalled from the perspectives of a bandit, the bride, the samurai's ghost and a woodcutter.", Rashomon,8.0 - 8.9 (Great),1950s
382,1991,84,0,8.0,481000.0,A prince cursed to spend his days as a hideous monster sets out to regain his humanity by earning a young woman's love., Beauty and the Beast,8.0 - 8.9 (Great),1990s
392,1969,110,10,8.0,227000.0,"In 1890s Wyoming, Butch Cassidy and The Sundance Kid lead a band of outlaws. When a train robbery goes wrong, they find themselves on the run with a posse hard on their heels. After considering their options, they escape to South America.", Butch Cassidy and the Sundance Kid,8.0 - 8.9 (Great),1960s
460,1940,99,10,8.0,39000.0,"Two employees at a gift shop can barely stand each other, without realizing that they are falling in love through the post as each other's anonymous pen pal.", The Shop Around the Corner,8.0 - 8.9 (Great),1940s
511,2013,109,15,7.9,173000.0,We meet Jesse and Celine nine years on in Greece. Almost two decades have passed since their first meeting on that train bound for Vienna., Before Midnight,7.0 - 7.9 (Good),2010s
587,2019,154,12,7.9,44000.0,A coming-of-age story based on the lives of street rappers in Mumbai., Gully Boy,7.0 - 7.9 (Good),2010s
603,2019,113,18,7.8,407000.0,"An American expat tries to sell off his highly profitable marijuana empire in London, triggering plots, schemes, bribery and blackmail in an attempt to steal his domain out from under him.", The Gentlemen,7.0 - 7.9 (Good),2010s
654,1987,119,15,7.8,332000.0,"During Prohibition, Treasury agent Eliot Ness sets out to stop ruthless Chicago gangster Al Capone, and assembles a small, incorruptible team to help him.", The Untouchables,7.0 - 7.9 (Good),1980s
686,2018,101,10,7.8,192000.0,"Set in Japan, Isle of Dogs follows a boy's odyssey in search of his lost dog.", Isle of Dogs,7.0 - 7.9 (Good),2010s
711,2002,109,18,7.8,50000.0,"Sixteen-year-old Lilja and her only friend, the young boy Volodja, live in Russia, fantasizing about a better life. One day, Lilja falls in love with Andrej, who is going to Sweden, and invites Lilja to come along and start a new life.", Lilya 4-Ever,7.0 - 7.9 (Good),2000s
774,2014,129,15,7.7,719000.0,"A spy organisation recruits a promising street kid into the agency's training program, while a global threat emerges from a twisted tech genius.", Kingsman: The Secret Service,7.0 - 7.9 (Good),2010s
818,1978,91,18,7.7,308000.0,"Fifteen years after murdering his sister on Halloween night 1963, Michael Myers escapes from a mental hospital and returns to the small town of Haddonfield, Illinois to kill again.", Halloween,7.0 - 7.9 (Good),1970s
844,1987,153,10,7.7,135000.0,A young English boy struggles to survive under Japanese occupation of China during World War II., Empire of the Sun,7.0 - 7.9 (Good),1980s
853,2004,99,15,7.7,152000.0,"In Shanghai, China in the 1940s, a wannabe gangster aspires to join the notorious ""Axe Gang"" while residents of a housing complex exhibit extraordinary powers in defending their turf.", Kung Fu Hustle,7.0 - 7.9 (Good),2000s
982,2007,122,15,7.6,332000.0,A small-time rancher agrees to hold a captured outlaw who's awaiting a train to go to court in Yuma. A battle of wills ensues as the outlaw tries to psych out the rancher., 3:10 to Yuma,7.0 - 7.9 (Good),2000s
985,2014,103,0,7.6,49000.0,"Anna, a shy 12-year-old girl, is sent to spend time with her aunt and uncle who live in the countryside, where she meets Marnie. The two become best friends. But Anna gradually discovers that Marnie is not quite who she appears to be.", When Marnie Was There,7.0 - 7.9 (Good),2010s
42,1985,116,10,8.5,1300000.0,"Marty McFly, a 17-year-old high school student, is accidentally sent 30 years into the past in a time-traveling DeLorean invented by his close friend, the maverick scientist Doc Brown.", Back to the Future,8.0 - 8.9 (Great),1980s
74,2000,113,15,8.4,1300000.0,A man with short-term memory loss attempts to track down his wife's murderer., Memento,8.0 - 8.9 (Great),2000s
76,2017,105,10,8.4,597000.0,"Aspiring musician Miguel, confronted with his family's ancestral ban on music, enters the Land of the Dead to find his great-great-grandfather, a legendary singer.", Coco,8.0 - 8.9 (Great),2010s
94,1999,122,18,8.3,1200000.0,A sexually frustrated suburban father has a mid-life crisis after becoming infatuated with his daughter's best friend., American Beauty,8.0 - 8.9 (Great),1990s
126,1973,129,10,8.3,281000.0,Two grifters team up to pull off the ultimate con., The Sting,8.0 - 8.9 (Great),1970s
237,1965,172,0,8.1,263000.0,A young novice is sent by her convent in 1930s Austria to become a governess to the seven children of a widowed naval officer., The Sound of Music,8.0 - 8.9 (Great),1960s
295,1976,177,10,8.1,51000.0,This epic historical drama chronicles the life and times of Prophet Muhammad and serves as an introduction to early Islamic history., The Message,8.0 - 8.9 (Great),1970s
300,1955,117,18,8.1,70000.0,The wife and mistress of a loathed school principal plan to murder him with what they believe is the perfect alibi., Les Diaboliques,8.0 - 8.9 (Great),1950s
313,1949,114,18,8.1,36000.0,A psychopathic criminal with a mother complex makes a daring break from prison and leads his old gang in a chemical plant payroll heist., White Heat,8.0 - 8.9 (Great),1940s
427,2020,101,15,8.0,38000.0,"Aida is a translator for the UN in the small town of Srebrenica. When the Serbian army takes over the town, her family is among the thousands of citizens looking for shelter in the UN camp."," Quo vadis, Aida?",8.0 - 8.9 (Great),2020s
549,2002,112,15,7.9,118000.0,Two men share an odd friendship while they care for two women who are both in deep comas., Talk to Her,7.0 - 7.9 (Good),2000s
614,2012,143,12,7.8,734000.0,"James Bond's loyalty to M is tested when her past comes back to haunt her. When MI6 comes under attack, 007 must track down and destroy the threat, no matter how personal the cost.", Skyfall,7.0 - 7.9 (Good),2010s
647,2016,147,12,7.8,855000.0,Political involvement in the Avengers' affairs causes a rift between Captain America and Iron Man., Captain America: Civil War,7.0 - 7.9 (Good),2010s
651,2006,101,15,7.8,521000.0,A family determined to get their young daughter into the finals of a beauty pageant take a cross-country trip in their VW bus., Little Miss Sunshine,7.0 - 7.9 (Good),2000s
698,2014,102,10,7.8,366000.0,"When Hiccup and Toothless discover an ice cave that is home to hundreds of new wild dragons and the mysterious Dragon Rider, the two friends find themselves at the center of a battle to protect the peace.", How to Train Your Dragon 2,7.0 - 7.9 (Good),2010s
713,2006,141,15,7.8,171000.0,"The story of the battle of Iwo Jima between the United States and Imperial Japan during World War II, as told from the perspective of the Japanese who fought it.", Letters from Iwo Jima,7.0 - 7.9 (Good),2000s
731,1993,76,10,7.8,57000.0,Batman is wrongly implicated in a series of murders of mob bosses actually committed by a new vigilante assassin., Batman: Mask of the Phantasm,7.0 - 7.9 (Good),1990s
796,1990,103,10,7.7,656000.0,"An eight-year-old troublemaker, mistakenly left home alone, must defend his home against a pair of burglars on Christmas Eve.", Home Alone,7.0 - 7.9 (Good),1990s
801,2009,100,10,7.7,266000.0,"Wandering her rambling old house in her boring new town, an 11-year-old Coraline discovers a hidden door to a strangely idealized version of her life. In order to stay in the fantasy, she must make a frighteningly real sacrifice.", Coraline,7.0 - 7.9 (Good),2000s
807,1998,134,18,7.7,75000.0,"The lives of several individuals intertwine as they go about their lives in their own unique ways, engaging in acts which society as a whole might find disturbing in a desperate search for human connection.", Happiness,7.0 - 7.9 (Good),1990s
828,1992,100,15,7.7,117000.0,An examination of the machinations behind the scenes at a real estate office., Glengarry Glen Ross,7.0 - 7.9 (Good),1990s
930,2003,113,15,7.7,42000.0,"A teenage boy expelled from school for fighting arrives at a boarding school where the systematic bullying of younger students is encouraged as a means to maintain discipline, and decides to fight back.", Evil,7.0 - 7.9 (Good),2000s
960,2004,103,18,7.6,469000.0,"Two strangers awaken in a room with no recollection of how they got there, and soon discover they're pawns in a deadly game.", Saw,7.0 - 7.9 (Good),2000s
969,1985,97,15,7.6,82000.0,An ordinary word processor has the worst night of his life after he agrees to visit a girl in Soho he met that evening at a coffee shop., After Hours,7.0 - 7.9 (Good),1980s
978,1999,108,18,7.6,252000.0,Two Irish Catholic brothers become vigilantes and wipe out Boston's criminal underworld in the name of God., The Boondock Saints,7.0 - 7.9 (Good),1990s
39,1994,110,18,8.5,1300000.0,"12-year-old Mathilda is reluctantly taken in by Léon, a professional assassin, after her family is murdered. An unusual relationship forms as she becomes his protégée and learns the assassin's trade.", Leon,8.0 - 8.9 (Great),1990s
97,2000,102,18,8.3,903000.0,The drug-induced utopias of four Coney Island people are shattered when their addictions run deep.., Requiem for a Dream,8.0 - 8.9 (Great),2000s
144,2007,122,15,8.2,1100000.0,Violence and mayhem ensue after a hunter stumbles upon the aftermath of a drug deal gone wrong and over two million dollars in cash near the Rio Grande., No Country for Old Men,8.0 - 8.9 (Great),2000s
164,2004,156,15,8.2,377000.0,"Traudl Junge, the final secretary for Adolf Hitler, tells of the Nazi dictator's final days in his Berlin bunker at the end of WWII.", Downfall,8.0 - 8.9 (Great),2000s
180,1950,138,10,8.2,139000.0,A seemingly timid but secretly ruthless ingénue insinuates herself into the lives of an aging Broadway star and her circle of theater friends., All About Eve,8.0 - 8.9 (Great),1950s
311,1927,94,18,8.1,54000.0,"A sophisticated city woman seduces a farmer and convinces him to murder his wife and join her in the city, but he ends up rekindling his romance with his wife when he changes his mind at the last moment.", Sunrise: A Song of Two Humans,8.0 - 8.9 (Great),1920s
344,1998,107,Unknown,8.1,28000.0,"When Altan swipes prescription drugs from his brother Nuri's pharmacy, they soon find themselves on a dangerous but funny road trip to get rid of the stuff and escape the mafiosi Altan tried to double-cross. Along the way, the brother who are compete opposites finally bond.", Her Sey Ã‡ok GÃ¼zel Olacak,8.0 - 8.9 (Great),1990s
346,2021,155,12,8.0,879000.0,A noble family becomes embroiled in a war for control over the galaxy's most valuable asset while its heir becomes troubled by visions of a dark future., Dune: Part One,8.0 - 8.9 (Great),2020s
370,1990,181,10,8.0,293000.0,"Lieutenant John Dunbar, assigned to a remote western Civil War outpost, finds himself engaging with a neighbouring Sioux settlement, causing him to question his own purpose.", Dances with Wolves,8.0 - 8.9 (Great),1990s
411,2005,144,12,8.0,199000.0,"The true story of James J. Braddock, a supposedly washed-up boxer, who returned to the spotlight to win the heavyweight championship of the world.", Cinderella Man,8.0 - 8.9 (Great),2000s
522,1945,101,10,7.9,40000.0,The desperate life of a chronic alcoholic is followed through a four-day drinking bout., The Lost Weekend,7.0 - 7.9 (Good),1940s
616,2015,130,15,7.8,489000.0,"In 2006-2007 a group of investors bet against the United States mortgage market. In their research, they discover how flawed and corrupt the market is.", The Big Short,7.0 - 7.9 (Good),2010s
619,1987,107,18,7.8,458000.0,A team of commandos on a mission in a Central American jungle find themselves hunted by an extraterrestrial warrior., Predator,7.0 - 7.9 (Good),1980s
658,2016,118,15,7.8,236000.0,"In the forests of the Pacific Northwest, a father devoted to raising his six kids with a rigorous physical and intellectual education is forced to leave his paradise and enter the world, challenging his idea of what it means to be a parent.", Captain Fantastic,7.0 - 7.9 (Good),2010s
674,2013,134,12,7.8,495000.0,"The true story of Captain Richard Phillips and the 2009 hijacking by Somali pirates of the U.S.-flagged MV Maersk Alabama, the first American cargo ship to be hijacked in two hundred years.", Captain Phillips,7.0 - 7.9 (Good),2010s
884,2018,135,15,7.7,170000.0,A year in the life of a middle-class family's maid in Mexico City in the early 1970s., Roma,7.0 - 7.9 (Good),2010s
890,2016,101,10,7.7,139000.0,A young boy named Kubo must locate a magical suit of armour worn by his late father in order to defeat a vengeful spirit from the past., Kubo and the Two Strings,7.0 - 7.9 (Good),2010s
951,2006,117,15,7.6,868000.0,"In the ancient battle of Thermopylae, King Leonidas and 300 Spartans fight against Xerxes and his massive Persian army.",300,7.0 - 7.9 (Good),2000s
998,2007,122,15,7.6,69000.0,"A profile of Ian Curtis, the enigmatic singer of Joy Division whose personal, professional, and romantic troubles led him to die by suicide at the age of 23.", Control,7.0 - 7.9 (Good),2000s
137,2021,135,16,8.3,130000.0,"Shershaah is the story of PVC awardee Indian soldier Capt. Vikram Batra, whose bravery and unflinching courage in chasing the Pakistani soldiers out of Indian territory contributed immensely in India finally winning the Kargil War in 1999.", Shershaah,8.0 - 8.9 (Great),2020s
145,2019,119,15,8.2,683000.0,"April 6th, 1917. As an infantry battalion assembles to wage war deep in enemy territory, two soldiers are assigned to race against time and deliver a message that will stop 1,600 men from walking straight into a deadly trap.",1917,8.0 - 8.9 (Great),2010s
168,1989,127,10,8.2,815000.0,"In 1938, after his father goes missing while pursuing the Holy Grail, Indiana Jones finds himself up against the Nazis again to stop them from obtaining its powers.", Indiana Jones and the Last Crusade,8.0 - 8.9 (Great),1980s
200,2017,167,15,8.2,115000.0,"Amarendra Baahubali, the heir apparent to the throne of Mahishmati, finds his life and relationships endangered as his adoptive brother Bhallaladeva conspires to claim the throne.", Baahubali 2: The Conclusion,8.0 - 8.9 (Great),2010s
228,1998,117,18,8.1,864000.0,"Jeff ""The Dude"" Lebowski, mistaken for a millionaire of the same name, seeks restitution for his ruined rug and enlists his bowling buddies to help get it.", The Big Lebowski,8.0 - 8.9 (Great),1990s
252,2004,132,12,8.1,725000.0,"Frankie, an ill-tempered old coach, reluctantly agrees to train aspiring boxer Maggie. Impressed with her determination and talent, he helps her become the best and the two soon form a close bond.", Million Dollar Baby,8.0 - 8.9 (Great),2000s
265,2016,130,10,8.1,103000.0,"A young man is ostracized by his classmates after he bullies a deaf girl to the point where she moves away. Years later, he sets off on a path for redemption.", A Silent Voice,8.0 - 8.9 (Great),2010s
